"Recall Number","Product Safety Warning Number",Date,"Product Safety Warning Date","Recall Heading","Name of product",Description,"Hazard Description","Consumer Action","Original Product Safety Warning Announcement","Remedy Type",Units,Incidents,Remedy,"Sold At Label","Sold At",Importers,Manufacturers,Distributors,"Manufactured In","Custom Label","Custom Field"
25-060,,"December 05, 2024",,"Academy Sports + Outdoors Recalls Redfield 12- and 18-Gun Fireproof Safes Due to Serious Injury Hazard and Risk of Death","Redfield 12- and 18-Gun Fireproof Safes","This recall involves Academy Sports + Outdoors Redfield 12-Gun and 18-Gun Fireproof Safes. The 12-Gun Fireproof Safe has the model number 179498 and the 18-Gun Fireproof Safe has the model number 179499. “Redfield” is printed on the front door above the number pad. The model name and serial number are located on a red label at the bottom right corner of the safe door. The dark gray steel safes are used to store firearms and valuables. The 12-gun safe measures 53 inches high by 15 inches wide by 16 inches deep, and the 18-gun safe measures 55 inches high by 18 inches wide by 18 inches deep.ModelAffected Serial NumbersRedfield 12-Gun Fireproof SafeG02BXXXXXXXXXXG03BXXXXXXXXXXRedfield 18-Gun Fireproof SafeG10AXXXXXXXXXXG11AXXXXXXXXXXG12AXXXXXXXXXXG01BXXXXXXXXXXG02BXXXXXXXXXXG03BXXXXXXXXXX &nbsp;&nbsp;","The mechanical internal locking plates can fail to align and allow unauthorized users to open the gun safes, posing a serious injury hazard and risk of death.",,,"Refund, Replace","About 6,100","None reported","Consumers should immediately stop using the Redfield 12- and 18-Gun Fireproof Safes and return them to any Academy Sports + Outdoors store for a free replacement or a refund. Consumers can also contact Academy’s Customer Care to arrange for a replacement or refund.","Sold At","Academy stores and online at academy.com from February 2024 through August 2024 for between $350 and $600.","Academy Ltd., d/b/a Academy Sports + Outdoors, of Katy, Texas",,,Vietnam,,
24-255,,"June 06, 2024",,"SA Consumer Products Recalls Sanctuary Quick Access and Sports Afield Biometric Gun Safes Due to Serious Injury Hazard and Risk of Death","Sanctuary and Sports Afield Biometric Firearm Safes","This recall involves the Sanctuary Quick Access Biometric Home Safe and the Sports Afield Home Defense 4-Gun Biometric Safe. The black steel safes are used to store firearms and valuables. The Sanctuary Quick Access Biometric Home Safe measures 10 inches high by 14 inches wide by 10 inches deep, and the Sports Afield Home Defense 4-Gun Biometric Safe measures 55 inches high by 12 inches wide by 11 inches deep. The Sanctuary-branded safe has one shelf and can store approximately two firearms, while the Sports Afield-branded safe can store four firearms. The Sports Afield safe has the Sports Afield logo on the front of the safe.","The biometric lock on the gun safes can be opened by unauthorized users, posing a serious injury hazard and risk of death.",,,Repair,"About 133,370","The firm is aware of 77 reports of the safe being opened by unauthorized users. No injuries have been reported.","Consumers should immediately stop using the biometric feature of the recalled safe, remove the batteries from the safe, and only use the key when storing firearms. Contact SA Consumer Products to receive a free repair kit.","Sold At","The Sanctuary Quick Access Biometric Home Safes were sold at Costco and other stores nationwide, and online at Costco.com, for between $75 and $100. The Sports Afield Home Defense 4-Gun Biometric Safes were sold at firearm and sporting goods stores nationwide and online for between $500 and $600. The safes were sold from July 2020 through November 2023.","SA Consumer Products Inc., of Rolling Meadows, Illinois",,,China,,
24-130,,"February 22, 2024",,"Bulldog Cases Recalls Biometric Gun Safes Due to Serious Injury Hazard and Risk of Death","Bulldog Biometric Firearm Safes","This recall involves Bulldog Magnum Biometric Pistol Vaults, Magnum Biometric Pistol Vaults with Shelf, and Magnum Biometric Top Load Pistol Vaults. The black steel safes are used to store firearms and valuables. The pistol vault (BD4030B) measures 11.5 inches by 8 inches by 5.5 inches, and the pistol vault with shelf (BD4040B) measures 11.5 inches by 10 inches by 8 inches. The top load pistol vault (BD4055B) measures 11.5 inches by 9.8 inches by 2.5 inches. The pistol vault with shelf has one shelf and can store approximately two firearms. The model number can be found on a label on a silver sticker on the back right corner of the safe, and the brand name “Bulldog” appears on the front of the safe.NameModel NumberMagnum Biometric Pistol VaultBD4030BMagnum Biometric Pistol Vault with ShelfBD4040BMagnum Biometric Top Load Pistol VaultBD4055B","The biometric lock on the gun safes can be opened by unauthorized users, posing a serious injury hazard and risk of death.",,,"Replace, Repair","About 33,500","The firm received four reports of the safe being opened by an unauthorized user. No injuries have been reported.","Consumers should immediately stop using the biometric feature of the recalled safe, remove the batteries from the safe, and only use the key when storing firearms. Contact Bulldog to receive a repair kit or free replacement safe for consumers with the Magnum Biometric Pistol Vaults, or a free replacement safe for consumers with the Magnum Biometric Top Load Pistol Vaults.","Sold At","Bass Pro Shops, Walmart and firearm stores nationwide and online at www.Amazon.com from July 2016 through January 2024 for between $194 and $216.","Bulldog Cases, of Danville, Virginia",,,China,,
24-129,,"February 22, 2024",,"Machir Recalls Biometric Personal Safes Due to Serious Injury Hazard and Risk of Death","Machir Biometric Personal Safes","This recall involves certain Machir biometric personal safes used to store personal items. They measure about 10 inches by 14 inches by 10 inches. The serial numbers are located on the lower righthand corner of the front door of the safe. The following serial number ranges are included in this recall:Serial Number RangesSW190035551 – SW190038050SW190070151 – SW190072650SW190175401 – SW190175857&nbsp;SW190262061 – SW190264301SVA2001200005001 – SVA2001200007000SVA2001200014632 – SVA2001200014995SVA2001200015001 – SVA2001200017577SVA2001200086685 – SVA2001200089624SVA2001200164001 – SVA2001200165000SVA2001200115471 – SVA2001200119880&nbsp;SVA2001200122399 – SVA2001200124758SVA2001200172611 – SVA2001200174080","The biometric lock on the safes can fail and be opened by unauthorized users, posing a serious injury hazard and risk of death if the safe is used to store firearms.",,,Replace,"About 24,820","The firm has received 15 reports of the recalled safes being opened by unauthorized users when the biometric lock failed to secure the safe. No injuries have been reported.","Consumers should immediately stop using the biometric lock feature, remove the batteries, and only use the key for the recalled safes to store their items until they get the free replacement. Contact Machir to receive instructions on disabling the biometric lock feature and on how to receive a free replacement safe. Consumers will be asked to disable the biometric reader and email a photo of the disabled biometric reader to&nbsp;Info@machir.com in order to receive a replacement safe. The instructions on how to safely destroy the biometric reader are also located at&nbsp;http://machir.com/biorecall/.","Sold At","Walmart stores nationwide and online at Walmart.com and Machir.com from July 2019 through at least September 2021 for about $98.","Machir LLC, of Springfield, Missouri",,,China,,
24-128,,"February 22, 2024",,"Biometric Gun Safes Recalled Due to Serious Injury Hazard and Risk of Death; Sold Exclusively on Amazon.com by BBRKIN","MouTec brand Biometric Firearm Safes","This recall involves BBRKIN Biometric Gun Safe model number QCJJ01. The gray steel safe is used to store firearms and valuables. It measures about 13 inches by 14 inches by 15 inches. It has one shelf and can store approximately 5 firearms. The serial number is on a label on the front of the safe in the lower right corner of the safe and the brand name “MouTec” appears on the front of the safe. The safes have the following serial range: SQC202121000 through SQC202247603.","The biometric lock on the gun safes can be opened by unauthorized users, posing a serious injury hazard and risk of death.",,,"Replace, Repair","About 2,200","The firm received one report of the safe opened by an unauthorized user, a 6-year-old boy. No injuries have been reported.","Consumers should immediately stop using the biometric feature of the recalled safe, remove the batteries from the safe, and only use the key when storing firearms. Contact BBRKIN to receive a repair kit or to receive a free replacement safe. Consumers will be asked to disable the biometric reader and email a photo of the disabled biometric reader to&nbsp;support@bbrkin.com in order to receive a replacement safe. The instructions on how to safely disable the biometric reader are also located at&nbsp;www.securitysafe.store/recallreplacement.","Sold At","Amazon.com from September 2021 through February 2023 for between $170 and $400.","Jomani International Inc., of Monterey Park, California",,"Ningbo Moyumaoyi Co. Ltd., dba BBRKIN, of China ",China,,
24-127,,"February 22, 2024",,"Biometric Gun Safes Recalled Due to Serious Injury Hazard and Risk of Death; Imported by Awesafe","Awesafe Biometric Gun Safes","This recall involves certain Awesafe biometric gun safes. The recalled gun safes are black, can fit two pistols, and have the brand name “Awesafe” on the front.","The biometric lock on the safes can fail and be opened by unauthorized users, posing a serious injury hazard and risk of death.",,,Replace,"About 60,000","The firm has received reports of 71 incidents of the recalled gun safes being opened by unauthorized users when the biometric lock failed to secure the safe. No injuries have been reported.","Consumers should immediately stop using the biometric feature, remove the batteries, and only use the key for the recalled safes to store firearms until they get the free replacement safe. Contact Awesafe to receive instructions on disabling the biometric feature and to receive a free replacement safe. Consumers will be asked to disable the biometric reader and email a photo of the disabled biometric reader to&nbsp;Recall@awesafeus.com in order to receive a replacement safe. The instructions on how to safely disable the biometric reader are also located at&nbsp;http://awesafeus.com/RECALL. Once they receive their replacement safe, consumers should discard the recalled safe in accordance with local laws.","Sold At","Walmart stores nationwide and online at Amazon.com and Walmart.com from August 2019 until December 7, 2022, for about $130.","Shenghaina Technology Co. Ltd., d/b/a Awesafe, of China",,,China,,