25190,,"March 20, 2025",,"VC Group Recalls Wireless Portable Power Banks with Lithium-Ion Batteries Due to Fire and Burn Hazards","VC Group MagSafe Wireless Power Pack Portable Power Banks","This recall involves 5,000 mAh wireless portable power banks for electronic charging of MagSafe compatible phones and earphones. ""Velvet Caviar"" is engraved on the front plate and printed on the bottom on the back with model number ZHX-PB21. The PO numbers 1 through 10 (PO-PP001 to PO-PP010) are marked on the back. Power Packs that do not have a PO number are also subject to this recall.&nbsp;Note:&nbsp;Recalled lithium-ion batteries should be disposed of in accordance with any local and state ordinances, following the procedures established by your municipal recycling center for damaged/defective/recalled lithium batteries, because these potentially hazardous batteries must be handled differently than other batteries. Do not throw this recalled power bank in the trash. Do not deposit this recalled power bank in used battery recycling boxes found at various retail and home improvement stores.","The lithium-ion battery in the recalled power banks can overheat and ignite, posing fire and burn hazards to consumers.",,,Replace,"About 89,500","The firm has received 19 reports of the product overheating or catching on fire, resulting in 10 minor injuries.","Consumers should immediately stop using the recalled wireless portable power banks and contact VC Group for a free replacement power bank. To receive a replacement, consumers will be required to provide photographs of their power bank with the word “Recalled” written in permanent marker before uploading them to the firm’s website at&nbsp;https://velvetcaviar.com/pages/magsafe-battery-pack-recall. Consumers should dispose of the power banks in accordance with local and state regulations.","Sold Exclusively At","Online at velvetcaviar.com and Amazon.com from November 2022 through October 2024 for about $65.",,"VC Group, of Brooklyn, New York",,China,,
25169,,"March 13, 2025",,"Sublue Recalls Lithium-Ion Batteries Sold for Sublue Mix Underwater Scooters Due to Fire Hazard","Sublue Mix underwater scooters and replacement batteries (black batteries only)","This recall involves certain Sublue Mix underwater scooter lithium-ion batteries and replacement batteries. The scooters are used for gliding through water. The batteries covered by the recall are black only. The scooters were sold in arctic white, space blue and aqua blue. The scooters have “Sublue” printed on the top and “Whiteshark Mix Underwater Scooter” printed on the side. The battery compartment is located on the underside of the scooter.","The lithium-ion batteries can overheat and ignite, posing a fire hazard to consumers.",,,Replace,"About 40,370","Sublue has received 161 reports of thermal and swelling incidents involving the lithium-ion batteries, including eight reports of fire, one report of injury, and two reports of property damage totaling $651,400.","Consumers should stop using the scooters with the recalled batteries immediately and contact Sublue for a free new generation battery replacement (gray battery). Sublue will provide a battery collection kit for the consumer to return the recalled battery and will provide the replacement battery upon return of the recalled battery.Note: Do not throw this recalled battery in the trash or in used battery recycling boxes found at various retail and home improvement stores. Recalled lithium-ion batteries should be disposed of in accordance with any local and state ordinances, following the procedures established by municipal recycling centers for damaged, defective, or recalled lithium batteries, because these potentially hazardous batteries must be handled differently than other batteries.&nbsp;","Sold At","Online at www.amazon.com, www.costco.com, www.sublue.com, www.westmarine.com and other websites from June 2018 through February 2025 for approximately $550 (scooters) and $150 (replacement batteries).","Sublue Technology Inc., of Walnut, California",,,China,,
25142,,"February 20, 2025",,"Fjorden iPhone Camera Grips Recalled Due to Battery Ingestion Hazard; Violation of Reese’s Law Federal Safety Regulations for Consumer Products with Coin Batteries; Sold Exclusively on shop.fjorden.co by Fjorden Electra AS","Fjorden iPhone Camera Grips","This recall involves the Fjorden iPhone Camera Grip. The black rectangular grips attach to an iPhone to feel like a real camera and aid with taking photographs.","The recalled camera grips violate the mandatory federal regulation for consumer products containing button cell and coin batteries because, when the product is dropped, the battery tray can separate from its compartment, making the lithium coin battery easily accessible by children. If button cell or coin batteries are swallowed, the ingested batteries can cause serious injuries, internal chemical burns, and death.",,,Replace,"About 546","None reported","Consumers should stop using the recalled camera grip immediately and place it in an area that children cannot access. Contact Fjorden Electra AS to obtain a free replacement of the button cell battery tray and instructions. Fjorden Electra AS is notifying all known purchasers directly.Note:&nbsp;Button cell and coin batteries are hazardous. Batteries should be disposed of or recycled by following local hazardous waste procedures.","Sold At","Exclusively online at shop.fjorden.co from March 2024 through May 2024 for about $122.",,,,China,Retailer:,"Fjorden Electra AS, of Norway"
25111,,"January 30, 2025",,"Greater Goods Recalls Digital Kitchen Scales Due to Ingestion Hazard; Violations of Reese’s Law Federal Safety Regulations for Consumer Products with Coin Batteries and Child Resistant Coin Battery Packaging","Greater Goods Digital Kitchen Scales","This recall involves Greater Goods Digital Kitchen Scales, models: 0480, 0455, 0456, 0458, 0473, 0479, 0481, 0747, 0748, 0749, 0751, 0752, 0754.&nbsp;They are labeled with a sticker with the brand and model printed on the back and come in gray, black, blue, green, pink, red, silver and white colors. The Greater Goods logo is located on the top of the front panel of the scale.&nbsp;The scales come with a lithium CR3032 coin battery pre-installed and a spare CR3032 battery in the packaging.","The recalled digital kitchen scales violate the mandatory federal regulations for consumer products containing button cell or coin batteries, because the scale has a lithium coin battery that can be easily accessed by children, and a spare coin battery provided with the product not in child resistant packaging, as required by Reese’s Law. These violations pose an ingestion hazard. The recalled scales also do not have the required warnings. When button cell or coin batteries are swallowed, the ingested batteries can cause serious injuries, internal chemical burns, and death.",,,Repair,"About 349,500","None reported","Consumers should immediately remove the battery in the digital kitchen scale and place it in an area that children cannot access. Contact Greater Goods for information on how to receive a free recall kit, which includes a new replacement battery door that can be secured to the scale, the required labeling, and an updated instruction manual. Greater Goods, Amazon and Walmart are contacting all known purchasers directly.Note:&nbsp;Button cell and coin batteries are hazardous. Batteries should be disposed of or recycled by following local hazardous waste procedures.","Sold At","Online at Amazon, Walmart and Greater Goods from May 2023 through September 2024 for about $10.","Greater Goods LLC, of Saint Louis, Missouri ",,,China,,
25072,,"December 19, 2024",,"Charmast Power Banks Recalled Due to Fire and Burn Hazards; Sold by Charmast Exclusively on Amazon.com","Charmast power banks, model W1056","This recall involves Charmast power banks, model W1056. They were sold in black, blue, green, mint, pink and white colors. The brand name “Charmast” is printed on the front and “Model: W1056” is printed on the back.Note: Recalled lithium-ion batteries should be disposed of in accordance with any local and state ordinances, following the procedures established by your municipal recycling center for damaged/defective/recalled lithium batteries, because these potentially hazardous batteries must be handled differently than other batteries. Do not throw this recalled power bank in the trash. Do not deposit this recalled power bank in used battery recycling boxes found at various retail and home improvement stores.","The lithium-ion battery in the recalled power banks can overheat and ignite, posing fire and burn hazards to consumers.",,,Refund,"About 488,000","Charmast has received 44 reports of the recalled power banks expanding, igniting, melting, overheating or smoking, including four reports of consumers receiving burns or blisters.","Consumers should stop using the recalled power banks immediately and contact Charmast for instructions on how to receive a full refund. To receive a refund, consumers will be required to provide photographs of their model W1056 power bank, their names and dates of the photograph written in indelible (permanent) marker above the label, and the severed power cord. Consumers should dispose of the power banks in accordance with local and state regulations.","Sold At","Online at Amazon.com from December 2018 through September 2024 for between $14 and $25.",,,,China,Retailer:,"Shenzhen Charmast Technology Co. Ltd., of China"
25071,,"December 19, 2024",,"Chervon North America Recalls SKIL 40V 5.0Ah Lithium-Ion Batteries for SKIL Lawnmowers and Outdoor Tools Due to Fire and Burn Hazard","SKIL 40V 5.0 Ah Lithium-Ion Batteries","This recall involves SKIL brand&nbsp;40V 5.0Ah&nbsp;Lithium-Ion Batteries that were manufactured before May 1, 2021. “SKIL” and “PWRCORE 40” are printed on the batteries. The recalled batteries were sold individually under the model number BY8708-00 for use with all SKIL 40V tools and were also sold in a combination kit with&nbsp;SKIL 40V Brushless 20-in Push Mowers (Model #PM 4910-10) or SKIL 40V Brushless 20-in Self-Propelled Mowers (Model #SM4910-10).&nbsp;Only the battery&nbsp;is recalled. The model number BY8708-00 and manufacturing date code, which is the first three digits of the 9-digit serial number, are located on a nameplate on the top of the battery pack near the battery terminals. The following manufacturing date codes are included:Date Code (in Serial Number)Manufacturing Date&nbsp;911XXXXXXNov-19912XXXXXXDec-19026XXXXXXJun-20027XXXXXXJul-20028XXXXXXAug-20029XXXXXXSep-20030XXXXXXOct-20031XXXXXXNov-20121XXXXXXJan-21122XXXXXXFeb-21123XXXXXXMar-21124XXXXXXApr-21","The lithium-ion batteries can overheat, posing fire and burn hazards.",,,"Refund, Replace","About 63,000 (In addition, about 359 in Canada)","The firm has received 100 reports of thermal incidents involving the batteries including overheating, melting, smoking and fire. These included eight reports of minor burns and/or smoke inhalation and 49 reports of related property damage.","Consumers should immediately stop using the recalled lithium-ion batteries and contact Chervon for a free replacement or refund for the price of the battery. Consumers should register for the recall online at&nbsp;www.skil.com/recalls.&nbsp;Chervon will provide a battery collection kit for the consumer to return the recalled battery and will provide the requested remedy upon return of the recalled battery.&nbsp;","Sold At","Lowe’s and other hardware and home improvement stores nationwide and online at Amazon.com, Walmart.com and Lowes.com from October 2019 through December 2024 for about $170 (for batteries sold individually) and about $400 (for combination kits with lawnmowers).","Chervon North America Inc., of Naperville, Illinois",,,China,,
25066,,"December 12, 2024",,"HTRC C240 Battery Chargers Recalled Due to Fire and Burn Hazards; Risk of Serious Injury and Death; Manufactured by Shenzhen Haitan Technology Co.","HTRC C240 battery chargers","This recall involves HTRC C240 battery chargers sold for charging lithium-ion batteries. The defective chargers are black with two blue screens, numbered 1 and 2, and the model identifier “C240 DUO” printed between the screens. The brand name “HTRC” is printed at the bottom left corner.","The chargers can ignite or cause a connected battery to ignite, posing fire and burn hazards and risk of serious injury and death.",,,Refund,"About 34,600","HTRC has received 32 reports of fire and other thermal incidents, including five reports of significant property damage and one report of injury.","Consumers should immediately stop using the recalled chargers and contact HTRC for instructions on how to return the chargers for a full refund.","Sold At","AliExpress.com, Amazon.com, Banggood.com, eBay.com, HTRC-Direct.com and RCGoing.com from December 2017 through June 2024 for between $65 and $290.",,"Shenzhen Haitan Technology Co. Ltd., d/b/a HTRC, of China",,China,,
25061,,"December 05, 2024",,"Belkin Recalls Portable Wireless Battery Chargers for Smart Watches Due to Fire Hazard","Belkin BoostCharge Pro Fast Wireless Charger Power Banks 10K","This recall involves Belkin BoostCharge Pro Fast Wireless Charger portable 10K power banks with model number BPD005. The model number is printed on the back top of the power bank.&nbsp; The serial number is also printed on the back of the product, will be a total of 14 digits, and start with the numbers and letter “57V”. They were sold in black. The power banks have a white magnetic charger for smart watches. “Belkin” is written in white on the front of the power banks.&nbsp;Note:&nbsp;Recalled lithium-ion batteries should be disposed of in accordance with any local and state ordinances,&nbsp;following&nbsp;the procedures established by your municipal recycling center for damaged/defective/recalled lithium batteries,&nbsp;because&nbsp;these potentially hazardous batteries must be handled differently&nbsp;than other batteries. Do not throw this recalled battery in the trash. Do not deposit this recalled battery in used battery recycling boxes found at various retail and home improvement stores.","The lithium-ion batteries in the recalled power banks can overheat, posing a fire hazard.",,,Refund,"About 4,000 (In addition, about 62 were sold in Canada)","The firm has received one report of the recalled power bank catching fire, resulting in a house fire involving property damage.","Consumers should immediately stop using the recalled power banks and contact Belkin to receive a full refund or store credit. Consumers will need to submit photos showing the front and back of the power bank with their recall submission form.&nbsp; Consumers should dispose of the lithium-ion battery in accordance with local and state regulations and not in household trash.","Sold At","Online at Amazon.com, belkin.com and other websites from May 2023 through June 2024 for about $100.","Belkin International Inc.¸ of El Segundo, California",,,China,,
25035,,"November 07, 2024",,"Quad Lock MAG Battery Pack Recalled Due to Fire Hazard; Imported by Quad Lock","MAG Battery Packs","This recall involves the Quad Lock MAG Battery Pack wireless portable charger. The power bank is a wireless portable charger, equipped with chargeable lithium-ion batteries and were sold in black. The power banks measure three inches long and two inches wide. Quad Lock is stamped in the plastic on the front and the model number is stamped on the back of the battery pack.&nbsp;Note:&nbsp;Recalled lithium-ion batteries should be disposed of in accordance with any local and state ordinances, following the procedures established by your municipal recycling center for damaged/defective/recalled lithium batteries, because these potentially hazardous batteries must be handled differently than other batteries. Do not throw this recalled battery in the trash. Do not deposit this recalled battery in used battery recycling boxes found at various retail and home improvement stores.","The battery pack in the chargers can overheat, posing a fire hazard.",,,Refund,"About 13,700 (In addition, about 1,580 were sold in Canada)","Quad Lock has received 39 reports of incidents in the United States, including three reports of fire and 36 reports of smoking, melting, cracking or swelling, resulting in two reports of property damage. Quad Lock has received 170 reports of incidents internationally, including four reports of fire and 166 reports of smoking, melting, cracking or swelling, resulting in one report of property damage.","Consumers should immediately stop using the recalled battery packs, remove them from the charger and contact Quad Lock for a full refund of the purchase price&nbsp;or a store credit. Visit&nbsp;www.quadlockcase.net/recall to participate in the recall. Consumers should dispose of lithium-ion batteries in accordance with local and state regulations and not in the trash.","Sold At","Online at www.quadlockcase.com and www.amazon.com and through various third-party sellers worldwide from April 2023 through September 2024 for between $60 and $80.","Annex Products Pty Ltd., dba Quad Lock, of Australia",,,China,,
25026,,"October 31, 2024",,"Humane Recalls Charge Case Accessory for Ai Pin Due to Lithium Battery Fire Hazard","Humane Charge Case Accessory for Ai Pin","This recall involves the Humane Charge Case Accessory. The Charge Case Accessory charges the Humane Ai Pin. The Ai Pin is an AI-powered multi-modal wearable device. The Charge Case Accessory contains a lithium polymer rechargeable battery pack that is charged via a USB-C charge port. The Charge Case Accessory is chrome with the Humane logo in gray on the back of the case. The Charge Case Accessory measures about 2 ¾ x 1 ½ x 2 ¼ inches. This recall only includes the Humane Charge Case Accessory and no other Humane products.Note:&nbsp;Recalled lithium-ion batteries should be disposed of in accordance with local and state ordinances, following the procedures established by your municipal recycling center for damaged/defective/recalled lithium batteries, because these potentially hazardous batteries must be handled differently than other batteries. Do not throw this recalled battery in the trash. Do not deposit this recalled battery in used battery recycling boxes found at various retail and home improvement stores.","The lithium battery in the recalled Charge Case Accessory can overheat, posing a fire hazard.",,,"Dispose, No Remedy Available","About 10,500","The firm has received one report of a charge case overheating and melting during charging. No injuries or property damage have been reported.","The remedy is no longer available. Consumers should immediately stop using the recalled charge case accessory for Ai Pin, destroy and discard it.","Sold At","Online at humane.com from November 2023 through May 2024. The Charge Case Accessory was sold with the Humane Ai Pin Complete System for between $700 and $800 and sold separately for about $150.","Humane Inc., of San Francisco, California",,,China,,
25011,,"October 17, 2024",,"Anker Power Banks Recalled Due to Fire and Burn Hazards; Manufactured by Anker Innovations","Anker Power Banks","This recall involves Anker Power Banks with model numbers A1642, A1647 and A1652. The power bank can be used as a portable electronic charging device for smartphones, tablets, and laptops with a 12W (A1642), 15W(A1647), 20W(A1652) maximum output. Anker is engraved on the front and the model numbers A1642, A1647 and A1652 are located on the back of the power bank.&nbsp;Note: Recalled lithium-ion batteries should be disposed of in accordance with any local and state ordinances, following the procedures established by your municipal recycling center for damaged/defective/recalled lithium batteries, because these potentially hazardous batteries must be handled differently than other batteries. Do not throw this recalled battery in the trash. Do not deposit this recalled battery in used battery recycling boxes found at various retail and home improvement stores.","The lithium-ion battery in the power banks can overheat, posing fire and burn hazards.",,,Replace,"About 2,100","The firm has received 28 reports of incidents of the batteries overheating, exploding, and the power bank catching on fire. Two injuries which included first and second degree burns to the consumer’s hands have been reported.","Consumers should immediately stop using the recalled power banks and contact Anker Innovations for instructions on receiving a free replacement power bank. Visit https://www.anker.com/product-recalls to register for the recall. Consumers should dispose of the lithium-ion batteries in accordance with local and state regulations.","Sold At","Best Buy, Target, NEXT TRADING SAS, C2 Wireless and K Spider Inc. stores nationwide, and online at Amazon.com, ebay.com, AAliExpress.com, and Walmart.com, from January 2024 through July 2024 for between $40 and $60.",,"Anker Innovations Limited, of Hong Kong, China",,China,,
24352,,"August 29, 2024",,"Glow in Dark Party Supplies Toy Sets Recalled Due to Ingestion Hazard; Violation of Federal Regulations for Battery-Operated Toys; Sold Exclusively on Amazon.com by OleOleToy","Glow in Dark Party Supplies Toy Sets","This recall involves Glow in Dark Party Supplies Toy Sets with button cell batteries. The toy sets include 250 glow sticks, 12 foam glow sticks, 12 LED glasses and 12 bunny ear headbands, and come in various colors.","The recalled Glow in Dark Supplies Toy Sets violate the mandatory federal battery-operated toy regulation because the Bunny Ears Headbands found in the sets contain button cell batteries that can be easily accessed without requiring the use of a common household tool. When button cell batteries are swallowed, the ingested batteries can cause serious injuries, internal chemical burns and death, posing an ingestion hazard to children.",,,Refund,About 984,"None reported","Consumers should immediately stop using the recalled Bunny Ears Headbands found in Glow in Dark Party Supplies Toy Sets and take them away from children. Consumers should cut the battery compartment off the Bunny Ears Headbands and contact OleOleToy for instructions on how to receive a full refund. Button cell batteries are hazardous. Batteries should be disposed of or recycled by following local procedures for hazardous household waste. Amazon is notifying all known purchasers directly.","Sold At","Exclusively online at Amazon.com from December 2023 through March 2024 for about $40.","Yiwu Shanshi Trading Co. Ltd., of China",,,China,Retailer:,"OleOleToy, of China"
