25470,,"September 18, 2025",,"Arizer Solo II Portable Vaporizers Recalled Due to Fire and Burn Hazards; Imported by 7111495 Canada","Arizer Solo II portable electronic vaporizer devices","This recall involves the Arizer Solo II, a portable electronic vaporizer device powered by an internal lithium-ion battery. The unit features a rigid anodized aluminum housing and is available in Carbon Black and Mystic Blue finishes. It includes a front-facing digital display for temperature and device settings, with a stainless steel heating chamber and removable glass components. Only vaporizers with a serial number starting with “M2” are included in this recall. The serial number is etched on the bottom of the device. UPC 628078800836 is printed on the product packaging.","The internal lithium-ion battery can overheat, produce smoke, and/or eject material, posing fire and burn hazards.",,,Replace,"About 5,460 (in addition, about 2,820 were sold in Canada)","The firm has received nine reports of the battery overheating, producing smoke, or ejecting material. No injuries have been reported.","Consumers should immediately stop using the Arizer Solo II portable vaporizers and contact 7111495 Canada for a free replacement. Customers whose serial number is confirmed as impacted will receive a free Solo II MAX replacement and wax to be used for disposal. The recalled unit must be disabled by inserting the provided wax into the charging port, then disposed of at a local hazardous waste or battery recycling facility in accordance with local regulations.&nbsp;Note: Do not throw this recalled lithium-ion battery or device in the trash, the general recycling stream (e.g., street-level or curbside recycling bins), or used battery recycling boxes found at various retail and home improvement stores. Recalled lithium-ion batteries must be disposed of differently than other batteries, because they present a greater risk of fire. Your municipal household hazardous waste (HHW) collection center may accept this recalled lithium-ion battery or device for disposal. Before taking your battery or device to a HHW collection center, contact that office ahead of time and ask whether it accepts recalled lithium-ion batteries. If it does not, contact your municipality for further guidance.","Sold At","Specialty, health and wellness, and adult novelty stores nationwide and on arizer.com from June 2024 through July 2025 for about $170.","7111495 Canada Inc., dba Arizer Tech, of Waterloo, Ontario ",,,China,,
25449,,"August 28, 2025",,"CT-ENERGY Lithium Coin Battery Chargers Recalled Due to Risk of Serious Injury or Death from Battery Ingestion; Violations of Standard for Coin Battery Products and Statute for Battery Packaging; Imported by CT New Energy Technology","CT-ENERGY Lithium Coin Battery Chargers with Rechargeable 2032 Batteries","This recall involves CT-ENERGY Lithium Coin Battery Chargers with model number “nc-02”. The product includes the charger, four rechargeable 2032 lithium-ion batteries, and a USB cable. The brand name “CT-ENERGY” is on the front of the product and the model number “nc-02” is printed on the back.","The recalled battery charger violates the mandatory standard for consumer products containing button cell or coin batteries because the charger has lithium coin batteries that can be accessed easily by children. In addition, the coin batteries provided with the battery charger are not in child-resistant packaging, and the packaging does not have the warnings as required by Reese’s Law. When button cell or coin batteries are swallowed, the ingested batteries can cause serious injuries, internal chemical burns and death.",,,"Refund, Replace, Repair","About 1,100","None reported","Consumers should immediately stop using the charger and remove the batteries and place them in an area that children cannot access. Contact CT New Energy Technology for a full refund, Child-Resistant Safety Case, or replacement kit. The complimentary repair kits and replacement kits will be available after August 30, 2025. Consumers will be asked to submit photos of the batteries’ destruction completely submerged in tap water to info@ct-energy.cn. Soaking the batteries in water for 24 hours discharges the battery.Note: Button cell and coin batteries are hazardous. Batteries should be disposed of or recycled by following local hazardous waste procedures.","Sold At","Amazon.com and Walmart.com from March 2024 through May 2025 for about $17",,,,China,Retailer:,"CT (Foshan) New Energy Technology Co., Ltd. (dba CT-Energy), of China"
25437,,"August 14, 2025",,"ESR HaloLock Wireless Power Banks Recalled Due to Fire and Burn Hazards; Distributed by Waymeet","ESR HaloLock Wireless Power Banks","This recall involves ESR HaloLock wireless power banks with model numbers 2G520, 2G505B and 2G512B. “ESR"" is printed on the back and the model number is printed on the right side of the pocket-size power banks. They were sold in dark blue, light blue, gray, white and black. All recalled models have five circular LED display lights on one side.","The lithium-ion battery in the recalled power banks can overheat and ignite, posing fire and burn hazards to consumers.",,,Refund,"About 24,000 (In addition, about 9,900 were sold in Canada)","The firm has received nine reports of the lithium-ion battery catching fire and exploding, resulting in property damage of about $20,000. No injuries have been reported.","Consumers should immediately stop using the recalled power banks and contact Waymeet for a full refund. Consumers will be asked to send to support@esrtech.com their order number (not required) and a photo of the recalled power bank showing the model number with the word “Recalled” written on it in permanent marker. Consumers should dispose of the power banks in accordance with local and state hazardous waste disposal regulations.Note: Do not throw this recalled lithium-ion battery or device in the trash, the general recycling stream (e.g., street-level or curbside recycling bins), or used battery recycling boxes found at various retail and home improvement stores. Recalled lithium-ion batteries must be disposed of differently than other batteries, because they present a greater risk of fire. Your municipal household hazardous waste (HHW) collection center may accept this recalled lithium-ion battery or device for disposal. Before taking your battery or device to a HHW collection center, contact that office ahead of time and ask whether it accepts recalled lithium-ion batteries. If it does not, contact your municipality for further guidance.","Sold At","Amazon.com, Homedepot.com and Esrtech.com from September 2023 through July 2025 for between $32 and $40.",,,"Waymeet Limited, of Hong Kong",China,,
25390,,"July 17, 2025",,"iStore Magnetic Wireless Power Banks Recalled Due to Fire and Burn Hazards; Imported by Tomauri","iStore Magnetic Wireless Power Banks (IST-09991/W05 model only)","This recall involves the iStore Magnetic Wireless Power Bank, 5000 mAh portable charger. Only model number IST-09991/W05 power banks are included in the recall. The iStore logo is engraved on the front side of the power bank, and the model number is printed on the back, as shown in the photos above. Some units may also have the word “iStore” printed above the model number. The power banks are compatible with various mobile devices, and measure 3 inches by 2 inches by 0.25 inches and weigh around 3.2 ounces. The product was sold with a USB-C to USB-C cable that measures about 12 inches long.Note: Do not throw this recalled lithium-ion battery or device in the trash, the general recycling stream (e.g., street-level or curbside recycling bins), or used battery recycling boxes found at various retail and home improvement stores. Recalled lithium-ion batteries must be disposed of differently than other batteries, because they present a greater risk of fire. Your municipal household hazardous waste (HHW) collection center may accept this recalled lithium-ion battery or device for disposal. Before taking your battery or device to a HHW collection center, contact that office ahead of time and ask whether it accepts recalled lithium-ion batteries. If it does not, contact your municipality for further guidance.","The lithium-ion battery in the recalled power banks can overheat and ignite while charging, posing fire and burn hazards to consumers.",,,Refund,"About 8,520 (An additional 6,400 were sold in Canada)","The firm has received three reports of the wireless power banks overheating and exploding while they were charging, including one incident that resulted in a minor burn to the victim’s arm. The firm received reports of property damage of about $15,000.","Consumers should immediately stop using the recalled wireless portable power bank and go to the firm’s website to participate in the recall. Consumers will be asked to submit two photographs via email to recall@istore.co. The first photograph should be the front of the power bank with the word “Recalled” and the date written on it with permanent marker. The second photograph should include the model number, which is located on the back of the power bank.&nbsp;A purchase receipt will be requested but will not be required to participate in the recall. Consumers should immediately dispose of the power banks in accordance with local and state hazardous waste disposal regulations.","Sold At","Vending machines and stores located in various airport locations nationwide and online at iStore.co from February 2023 through May 2025 for between $46 and $65.&nbsp;","Tomauri Inc., of Ontario, Canada",,,China,,
25355,,"June 26, 2025",,"DR Power Recalls Lithium-Ion Battery Packs Due to Fire and Burn Hazards","DR Power LiPRO rechargeable lithium-ion battery packs (5.0 Ah)","This recall involves&nbsp;62-volt 5.0 Ah LiPRO rechargeable lithium-ion battery packs for use with DR Power brand battery-powered products, such as lawnmowers, trimmers and snow throwers. The products include stand-alone battery packs with model number 414240, and removeable battery packs included with DR Power outdoor yard equipment items with model numbers 524340, SB11022XEN, T4X3026XEN, T4X3062XENR, CE75021XEN0 and CE77021XEN0. Information containing the model number for the battery pack (“41424”) is located on the battery pack’s label. The LiPRO and DR Power logo are on the front and side panels of the battery pack.Note:&nbsp;Do not throw this recalled lithium-ion battery or device in the trash, the general recycling stream (e.g., street-level or curbside recycling bins), or used battery recycling boxes found at various retail and home improvement stores. Recalled lithium-ion batteries must be disposed of differently than other batteries, because they present a greater risk of fire. Your municipal household hazardous waste (HHW) collection center may accept this recalled lithium-ion battery or device for disposal. Before taking your battery or device to a HHW collection center, contact that office ahead of time and ask whether it accepts recalled lithium-ion batteries. If it does not, contact your municipality for further guidance.","The recalled battery packs can short-circuit and ignite, posing fire and burn hazards to consumers.",,,Refund,"About 13,200","The firm has received two reports of incidents of fire and/or overheating. No injuries have been reported.","Consumers should immediately stop using the recalled battery packs and contact DR Power for a pro-rated refund, based on the battery’s age. Consumers will need to show proof of the battery pack’s destruction by uploading two photographs in accordance with the destruction instructions (provided on the firm’s recall website), and filling out the recall form online at&nbsp;https://www.drpower.com/5AHB-recall. If consumers choose to dispose of the recalled battery pack’s lithium-ion battery, it should be done in accordance with local and state regulations.&nbsp;","Sold At","Home improvement and hardware stores nationwide and online at DRPower.com and CountryHomeProducts.com from April 2018 through July 2024 for between $300 and $700 for outdoor equipment that includes battery packs, and for $250 for battery packs sold individually.&nbsp;","Generac Power Systems Inc., of Waukesha, Wisconsin","Ningbo New Team Import &amp; Export Co. Ltd. (“Lera”), of China",,China,,
25338,,"June 12, 2025",,"More than One Million Anker Power Banks Recalled Due to Fire and Burn Hazards; Manufactured by Anker Innovations","Anker PowerCore 10000 power banks (model A1263 only)","This recall involves Anker PowerCore 10000 power banks with model number A1263.&nbsp;The brand name “Anker” is engraved on the front of the product. The model number “A1263” and serial number “SN” are printed on the bottom. Only model number A1263 power banks sold in the U.S. with qualifying serial numbers are included in the recall. Consumers should check their serial number at&nbsp;https://www.anker.com/product-recalls to determine whether their power bank is included in the recall.Note: Do not throw this recalled lithium-ion battery or device in the trash, in the general recycling stream (e.g., street-level or curbside recycling bins), or in used battery recycling boxes found at various retail and home improvement stores. Recalled lithium-ion batteries must be disposed of differently than other batteries, because they present a greater risk of fire. Your municipal household hazardous waste (HHW) collection center may accept this recalled lithium-ion battery or device for disposal. Before taking your battery or device to a HHW collection center, contact it ahead of time and ask whether it accepts recalled lithium-ion batteries. If it does not, contact your municipality for further guidance.","The lithium-ion battery in the power bank can overheat, posing fire and burn hazards to consumers.",,,Replace,"About 1,158,000","Anker has received 19 reports of fires and explosions. This includes two reports of minor burn injuries not requiring medical attention and 11 reports of property damage totaling over $60,700.","Consumers should immediately stop using the recalled power banks and contact Anker Innovations for instructions on receiving a free replacement power bank. Visit&nbsp;https://www.anker.com/product-recalls to register for the recall. To receive a replacement, consumers will be required to submit a photo of their recalled power bank showing the model number, serial number, their name, the date of the photograph, and the word “recalled” written on the power bank in permanent marker. A purchase receipt will be requested but will not be required to participate in the recall. Consumers will also be required to confirm disposal of the power bank in accordance with applicable laws and regulations before receiving a replacement.","Sold At","Online at Anker, Amazon, Newegg and Ebay from June 2016 through December 2022 for about $27.",,"Anker Innovations Limited, of China",,China,,
25304,,"May 29, 2025",,"iWALK Magnetic Wireless Power Banks Recalled Due to Fire and Burn Hazards; Manufactured by U2O Global","iWALK Magnetic Wireless Power Banks","This recall involves iWALK Magnetic Wireless Power Banks. “iWALK” is printed on the front of each power bank, and the model numbers and serial numbers are printed on the back. The pocket-sized power banks are compatible with various devices and were sold in a variety of colors.&nbsp; All recalled models include a circular LED display screen on the front to reflect the remaining power of the power bank.&nbsp; Models DBL6000M and DBL6000P include a circular phone holder ring above the LED display screen.&nbsp; The following model numbers and serial numbers are included in this recall.Model NumberSerial NumbersMXB008GK2309880, GK2309899, GK2310154, GK2310155, GK2310157, GK2310160, GK2310346, GK2311108, GK2311109, GK2311110, GK2311315, GK2311396DBL6000M / DBL6000PGK2309901, GK2309902, GK2309903, GK2310005, GK2310006, GK2310163, GK2310165, GK2311388, GK2312035, GK2312036, GK2312282, GK2312461, GK2312462, GK2312737, GK2312770, GK2401164, GK2401564, GK2403407, GK23081458, GK23081460, GK23081462Note: Do not throw this recalled lithium-ion battery or device in the trash, in the general recycling stream (e.g., street-level or curbside recycling bins), or in used battery recycling boxes found at various retail and home improvement stores. Recalled lithium-ion batteries must be disposed of differently than other batteries, because they present a greater risk of fire. Your municipal household hazardous waste (HHW) collection center may accept this recalled lithium-ion battery or device for disposal. Before taking your battery or device to a HHW collection center, contact that office ahead of time and ask whether they accept recalled lithium-ion batteries. If it does not, contact your municipality for further guidance.","The lithium-ion batteries in the recalled power banks can overheat and ignite, posing a risk of serious injury or death from fire and burn hazards to consumers.",,,Refund,"About 27,500","The firm has received 15 reports of the lithium-ion battery catching fire, resulting in 10 burn injuries.","Consumers should immediately stop using the recalled power banks and contact U2O Global for a full refund. To receive a refund, consumers should send a photo of the recalled power bank, showing the model number and the serial number, with “Recalled” written on the power bank in permanent marker to U2O Global by email at&nbsp;service@iwalk.net. Consumers should dispose of the recalled power banks in accordance with local hazardous waste disposal procedures.","Sold At","Online at iWalkMall.com, Amazon.com and other e-commerce websites from July 2021 through March 2024 for between $20 and $57.",,"U2O Global Co. Ltd., of China",,China,,
25248,,"May 01, 2025",,"Baseus Portable Chargers Recalled Due to Fire Hazard; Sold on Amazon.com by Shenzhen Baseus Technology","Baseus 65W 30000mAh Portable Chargers (model number BS-30KP365)","This recall involves&nbsp;Baseus 65W 30000mAh portable chargers with model number BS-30KP365 and a serial number ending in the number 0 through 9 or the letter “D.” The recalled portable chargers were sold in black and white and have “65w” printed on the front. The bottom contains a printed label with the brand name “Baseus,” the model number “BS-30KP365,” and the serial number, beginning “SN.”Note: Do not throw this recalled lithium-ion battery or device in the trash, in the general recycling stream (e.g., street-level or curbside recycling bins), or in used battery recycling boxes found at various retail and home improvement stores. Recalled lithium-ion batteries must be disposed of differently than other batteries, because they present a greater risk of fire. Your municipal household hazardous waste (HHW) collection center may accept this recalled lithium-ion battery or device for disposal. Before taking your battery or device to a HHW collection center, contact them ahead of time and ask whether they accept recalled lithium-ion batteries. If they don’t, contact your municipality for further guidance.","The lithium-ion battery in the recalled portable chargers can overheat, posing a fire hazard.",,,Replace,"About 55,380","Baseus has received 76 reports of incidents involving the portable chargers, including 72 reports of bulging and four reports of fire, including three reports of property damage.","Consumers should immediately stop using the recalled&nbsp;portable chargers&nbsp;and contact Baseus to receive a free replacement charger. The replacement portable charger will have the same model number (BS 30KP365) and a different serial number ending in the letter “A.” Consumers will need to submit a photo of the recalled portable charger showing the model number and serial number to the firm’s&nbsp;recall registration page. Consumers without an order number will need to submit a photo of the portable charger with their name and date written on the portable charger in permanent marker. Visit&nbsp;https://www.baseus.com/pages/recall_select_BS-30KP365 to register and get instructions on how to receive a free replacement. To receive a replacement, consumers will be required to confirm disposal of the portable charger in accordance with applicable laws and regulations.","Sold At","Online at Amazon.com, AliExpress.com, Walmart.com and Baseus.com from April 2020 through April 2025 for between $39 and $90.","Shenzhen Baseus Technology Co. Ltd., of China",,,China,,
25232,,"April 24, 2025",,"AliExpress Recalls LED Strip Lights Due to Risk of Serious Injury or Death from Ingestion Hazard; Violations of Reese’s Law Federal Safety Regulations for Consumer Products with Coin Batteries; Sold on AliExpress.com","LED Strip Lights","This recall involves RGB-branded LED strip lights powered with button batteries. The color-changing, dimmable lights measure about 0.4 inches long and were sold in white, warm white, blue, ice blue, green, red, yellow, purple and pink.&nbsp;&nbsp;","The recalled lights violate the mandatory federal regulations for consumer products designed to use button cell or coin batteries because the strip lights allow easy access by children to the lithium coin batteries, posing an ingestion hazard. In addition, the recalled products do not have the required warnings. When button cell or coin batteries are swallowed, the ingested batteries can cause serious injuries, internal chemical burns and death.",,,Refund,"About 390","None reported","Consumers should stop using the recalled LED strip lights immediately and contact AliExpress to receive a full refund. Consumers should destroy the lights by cutting them in half and disposing of them. Consumers must send a photo of the destroyed lights to us_product_recall@aliexpress.com or&nbsp;by replying to the recall email sent by AliExpress. AliExpress is contacting all known purchasers directly.Note:&nbsp;Button cell and coin batteries are hazardous. Batteries should be disposed of or recycled by following local hazardous waste procedures.","Sold At","Aliexpress.com from March 2024 through November 2024 for about $3.",,,,China,"Recalling Firm:","AliExpress, of San Mateo, California"
25227,,"April 17, 2025",,"Casely Recalls Wireless Portable Power Banks Due to Fire and Burn Hazards","Casely Wireless Portable Power Banks","This recall involves Casely Power Pods 5000mAh portable MagSafe wireless phone charger with model number E33A. ""Casely"" is engraved on the front side of the plate on the right side, and model number E33A is printed on the back. The pocket-sized power pods are compatible with various devices. The pods were sold in a variety of colors and prints. The pods measure 3 x 2 x 0.25 inches and weigh around 3.2 ounces.&nbsp;Note: Do not throw this recalled lithium-ion battery or device in the trash, in the general recycling stream (e.g., street-level or curbside recycling bins), or in used battery recycling boxes found at various retail and home improvement stores. Recalled lithium-ion batteries must be disposed of differently than other batteries, because they present a greater risk of fire. Your municipal household hazardous waste (HHW) collection center may accept this recalled lithium-ion battery or device for disposal. Before taking your battery or device to a HHW collection center, contact them ahead of time and ask whether they accept recalled lithium-ion batteries. If they don’t, contact your municipality for further guidance.&nbsp;","The lithium-ion battery in the recalled power banks can overheat and ignite, posing fire and burn hazards to consumers.&nbsp;",,,Replace,"About 429,200","The firm has received 51 consumer reports of the lithium-ion battery overheating, expanding or catching fire while they were charging their phones, resulting in six minor burn injuries.","Consumers should immediately stop using the recalled wireless portable power banks and contact Casely for a free replacement. To receive the free replacement, consumers should go to the firm’s website and fill out the online form and submit two photographs; one should be the front of the power bank with the word “Recalled” on it and the date written in permanent marker. The second photograph should have the model number on it, which is located on the back of the power bank. Then upload the photos to the firm’s website at&nbsp;https://www.getcasely.com/pages/2025-recall. Consumers should immediately dispose of the power banks in accordance with local and state regulations. Proof of purchase (receipt) is not required. Casely is contacting all known purchasers directly.","Sold At","Online at getcasely.com, Amazon.com and other e-commerce websites from March 2022 through September 2024 for between $30 and $70.","Casely Inc., of Brookyln, New York",,,China,,
