26102,,"November 20, 2025",,"Demlar Recalls MoonSoll and Magic Chems Fuel Bottles Due to Risk of Serious Injury or Death from Flash Fire; Violates Mandatory Standard for Portable Fuel Containers and FHSA Labeling Requirements; Imported by Demlar Online Store","MoonSoll and Magic Chems Fuel Bottles","This recall involves Demlar’s bottles of MoonSoll-branded ethanol and Magic Chems-branded bioethanol fuel, used for tabletop fire pits, fireplaces, stoves and burners. The clear fuel bottles have a red or green cap. They were sold individually or as a pack of three and in 500mL and 1000mL capacities. The brand name and capacity are printed on the front of the bottle’s label.","The ethanol fuel bottles violate the federal safety standard for portable fuel containers because they lack flame mitigation devices required by the&nbsp;https://www.cpsc.gov/Business--Manufacturing/Business-Education/Busines… Fuel Container Safety Act, posing a deadly risk of flash fire. The fuel containers also fail to meet the federal safety regulation for deceptive disclaimers required by the&nbsp;https://www.cpsc.gov/Business--Manufacturing/Business-Education/Busines… Hazardous Substances Act&nbsp;(FHSA) because they claim the contents are “Non-Toxic.”",,,Refund,"About 18,200","None reported","Consumers should immediately stop using the recalled fuel bottles, place them out of reach of children and contact Demlar for a full refund. Consumers will be asked to write “Do not use” and the Amazon order number with permanent marker on the container and submit a photo of it to&nbsp;info@demlar.com. Consumers should dispose of the fuel bottles in accordance with local and state regulations.Note: Consumers should follow local household hazardous waste (HHW) guidance for flammable liquids. Contact your city, county, or state HHW program for instructions, as requirements may differ by location. Safe approach: Keep the product in its container, clearly label it “Do Not Use,” and bring it to a local HHW drop-off.","Sold Online At","Amazon.com from May 2025 through July 2025 for between $16 and $32.","Demlar LLC, owner of the MoonSoll and Magic Chems brands dba Demlar Online Store, of Casper, Wyoming","STARKİM KİMYA SAN. T.C. A.Ş., of Turkey",,Turkey,,
26068,,"November 06, 2025",,"F&F Fine Wines Recalls Kirkland Signature Valdobbiadene Prosecco DOCG Bottles sold by Costco Due to Laceration Hazard","Kirkland Signature Valdobbiadene Prosecco DOCG bottles","This recall involves certain glass bottles of Kirkland Signature Valdobbiadene Prosecco DOCG. The UPC is 196633883742 and the Costco Item Number is 1879870. The product was sold in a green bottle with purple foil on the top and a purple label with the words “Kirkland Signature Valdobbiadene Prosecco Superiore DOCG”.","The Prosecco bottles can break or shatter, posing a laceration hazard.",,,Refund,"About 941,400","F&F Fine Wines International, Inc. has received ten reports of the bottles shattering or breaking, resulting in one laceration injury.","Consumers should immediately stop using the recalled bottles and not attempt to open them. Consumers should discard the recalled bottles in their household trash and contact Ethica Wines for instructions on how to obtain a full refund from Costco.","Sold At","Costco stores in IA, IL, IN, KY, MI, MN, MO, ND, NE, OH, SD, and WI from April 2025 through August 2025 for about $8.","F&F Fine Wines International, Inc. dba Ethica Wines, of Miami, Florida.",,,Italy,,
26030,,"October 16, 2025",,"Wilteexs Bioethanol Fuel Bottles Recalled Due to Risk of Serious Injury or Death from Flash Fire; Violates Mandatory Standards for Portable Fuel Containers and Hazardous Substances; Imported by Wilteexs","Wilteexs Bioethanol Fuel Bottles","This recall involves Wilteexs-branded bottles of bioethanol used for tabletop fire pits, fireplaces, stoves and burners. The 1.06 quarts/1liter clear bottles come pre-filled with fuel.&nbsp;“WILTEEXS,” “BIO ETHANOL” and an image of a burning flame are printed in blue and white on the front of the bottles. “X004IQ9ZCH” is printed below the barcode on the back of the bottles.&nbsp;Note:&nbsp;Recalled ethanol should be disposed of in accordance with any local and state regulations, contact your local hazardous waste treatment center or inquire about professional recycling points through the environmental protection agency. Do not dispose of ethanol in sewers, rainwater pipes or ordinary garbage cans to avoid causing fires or environmental pollution.&nbsp;","The ethanol fuel bottles violate the federal safety standard for portable fuel containers because they lack flame mitigation devices required by the&nbsp;https://www.cpsc.gov/Business--Manufacturing/Business-Education/Busines… Fuel Container Safety Act, posing a deadly risk of flash fire. The fuel containers also fail to meet the federal safety regulation for deceptive disclaimers required by the&nbsp;https://www.cpsc.gov/Business--Manufacturing/Business-Education/Busines… Hazardous Substances Act&nbsp;because they claim the contents are “Non Toxic”.&nbsp;",,,Refund,"About 1,100 ","None reported","Consumers should immediately stop using the recalled fuel bottles, place them out of reach of children, and contact Wilteexs for a full refund. Consumers will be asked to write “Do not use” and the Amazon order number with permanent marker on the bottle; and submit a photo of it to&nbsp;hongyaodemg@outlook.com. Consumers should dispose of the fuel bottles in accordance with local and state regulations.&nbsp;","Sold At","Amazon from April 2025 through July 2025 for about $17.","Hongyaodekejiyouxiangongsi, dba online seller Wilteexs, of China",,,China,,
26005,,"October 02, 2025",,"Dissolved Oxygen Test Kits Recalled Due to Risk of Serious Injury or Death from Poisoning to Young Children; Violates Mandatory Standard for Child-Resistant Packaging; Sold on Amazon by Almpal","Dissolved Oxygen Test Kits","This recall involves Almpal dissolved oxygen test kits. The test kits come in a cream-colored box bearing a white label with “Dissolved Oxygen Test Kit” and the manufacture date, batch number, and expiration date printed on it.","The recalled test kits contain a bottle of sulfuric acid, which must be in child-resistant packaging, as required by the&nbsp;https://www.cpsc.gov/Poison-Prevention-Packaging-Act"">Poison Prevention Packaging Act. The test kits violate the mandatory standard for child-resistant packaging because the bottle of sulfuric acid is not child-resistant, posing a risk of serious injury or death from poisoning, if the contents are swallowed by young children.",,,Refund,"About 470","None reported","Consumers should immediately secure the recalled test kits out of sight and reach of children and contact Almpal for how to properly dispose of the recalled bottles and for information on how to receive a full refund. Prior to disposing of the recalled kits, consumers will be asked to submit a photo to the seller’s account through Amazon's messaging platform. A full refund will be issued upon successful verification of the submitted images. Only unexpired kits are included in this recall, which involves kits sold after May 2025. Consumers should dispose of all kits, expired, unexpired or unused in accordance with local household hazardous waste regulations.&nbsp;Note: Physically returning the product is not required.","Sold Online At","Amazon from May 2025 through August 2025 for about $25",,,,China,Retailer:,"Ningbo Leha E-Commerce Co., Ltd., of China doing business as Amazon seller Almpal"
25460,,"September 11, 2025",,"Blueroot Health Recalls Bottles of Bariatric Fusion Iron Multivitamins Due to Risk of Serious Injury or Death from Child Poisoning; Violates Mandatory Standard for Child-Resistant Packaging; Manufactured by VitaQuest International","Bariatric Fusion Iron Multivitamin Bottles","This recall involves two types of Bariatric Fusion dietary supplement bottles: high ADEK multivitamin capsules (90 and 270-count bottles) and One Per Day bariatric multivitamin capsules (90-count bottle), both with 45mg of iron. The recalled bottles are white and orange. Only bottles with smooth cap tops that lack the “push down &amp; turn” embossed lettering are included in this recall. The Bariatric Fusion logo is printed on the front of the bottles. Lot number 0066J4, 0065J4, 0453B5&nbsp;or 0370B5 is printed on the bottom of the bottles.","The recalled multivitamins contain iron, which must be in child-resistant packaging, as required by the&nbsp;https://www.cpsc.gov/Poison-Prevention-Packaging-Act"">Poison Prevention Packaging Act. The recalled packaging of the iron-containing multivitamins violates the federal standard for child-resistant packaging because the bottle caps are not child-resistant, posing a risk of deadly poisoning, if the contents are swallowed by young children.",,,Replace,"About 4,700","None reported","Consumers should immediately secure the recalled bottles out of sight and reach of children, and contact Blueroot Health for information on how to obtain a free child-resistant replacement cap.","Sold Online At","Amazon.com, bariatricfusion.com and other websites from January 2025 through June 2025 for between $23 and $57.",,"VitaQuest International, LLC of Caldwell, New Jersey","Blueroot Health, Inc., of Middletown, Connecticut","United States",,
25399,,"July 24, 2025",,"Creekwood Naturals Recalls 100% Natural Pure Gum Spirits of Turpentine Bottles Due to Risk of Serious Injury or Death from Child Poisoning; Violates Mandatory Standard for Child Resistant Packaging","100% Natural Pure Gum Spirits of Turpentine Bottles","This recall involves Creekwood Naturals Gum Spirits of Turpentine bottles. The Gum Spirits of Turpentine comes in a clear glass bottle that has a brown label with red, black and white lettering. The front panel of the label on the bottle features ""Turpentine"" in large lettering, along with ""Pure Gum Spirits"" or ""Quality Gum Spirits.""","The recalled bottles contain turpentine, which must be in child-resistant packaging, as required by the Poison Prevention Packaging Act. The turpentine bottles violate the mandatory standard for child-resistant packaging, posing a deadly poisoning hazard to young children.",,,Replace,"About 9,000","None reported","Consumers should immediately secure the recalled turpentine bottles out of the sight and reach of children. Consumers should contact Creekwood Naturals for a free replacement child-resistant closure. Consumers must complete a form online at&nbsp;https://creekwoodnaturals.com/pages/recall to receive the replacement.","Sold Online At","Amazon, Etsy, Ebay and Creekwood Naturals from June 2023 through May 2025 for between $20 and $40.",,"Creekwood Naturals, of Corona, California",,"United States",,
25397,,"July 24, 2025",,"Diamond G Forest Products Recalls Turpentine Bottles Due to Risk of Serious Injury or Death from Child Poisoning; Violates Mandatory Standard for Child Resistant Packaging","Georgia Pine Gum Spirits of Turpentine Bottles","This recall involves 100% pure gum spirits of turpentine bottles. The 4-ounce, clear glass bottles are round and have a label with “Georgia Pine Gum Spirits of Turpentine” and “Diamond G Forest Products” printed on it.","The bottles contain turpentine, which must be in child-resistant packaging as required by the Poison Prevention Packaging Act. The packaging is not child-resistant, posing a risk of serious injury or death from poisoning if the contents are ingested by young children.",,,Replace,"About 20,000","None reported","Consumers should immediately secure the recalled turpentine bottles out of the sight and reach of children and contact Diamond G Forest Products for information on how to obtain a free replacement child-resistant closure.&nbsp;","Sold At","Nature’s Corner Market stores in Marietta, Georgia; Cornerstone Retreat stores in Gap, Pennsylvania; Nickel Mine Health Foods stores in Paradise, Pennsylvania; Leaves of The Trees in Memphis, Tennessee; Country Boy’s Mini Mall in Bristol, Georgia and online at Amazon from January 2021 through April 2025 for about $17.",,"Diamond G Forest Products LLC, of Patterson, Georgia",,"United States",,
25377,,"July 10, 2025",,"Walmart Recalls Ozark Trail 64 oz Water Bottles Due to Serious Impact and Laceration Hazards","Ozark Trail 64 oz Stainless Steel Insulated Water Bottles","This recall involves Ozark Trail 64 oz Stainless Steel Insulated Water Bottles sold with model number 83-662 on the product packaging. The stainless-steel bottles are silver with a black one-piece screwcap lid. They measure 4.41 x 4.41 x 11.5 inches and there is an Ozark Trail logo embedded on the side of the bottle. The model number does not appear on the product.","The lid can forcefully eject, posing serious impact and laceration hazards, when a consumer attempts to open the capped bottles after food, carbonated beverages or perishable beverages, such as juice or milk, are stored inside over time.",,,Refund,"About 850,000","Walmart has received three reports of consumers who were injured when struck in the face by a lid forcefully ejected from these bottles upon opening. Two consumers suffered permanent vision loss after being struck in the eye.","Consumers should immediately stop using the recalled water bottles and contact Walmart for a full refund. Consumers can bring the bottle to their nearest Walmart store for a refund.","Sold Exclusively At","Walmart stores nationwide and online at Walmart.com since 2017 for about $15.","Olympia Tools International Inc., of Covina, California and Walmart Inc., of Bentonville, Arkansas",,,China,,
25354,,"June 26, 2025",,"iHerb Recalls Bottles and Blister Packs of California Gold Nutrition Iron Supplements Due to Risk of Serious Injury or Death from Child Poisoning; Violation of Federal Standard for Child Resistant Packaging","California Gold Nutrition Iron Supplements: Daily Prenatal Multi, Ultamins Women’s Multivitamin, and Ultamins Women’s 50+ Multivitamin","This recall involves three types of California Gold Nutrition dietary supplements: Daily Prenatal Multi, Ultamins Women’s Multivitamin, and Ultamins Women’s 50+ Multivitamin.&nbsp;The California Gold Nutrition Daily Prenatal Multivitamin bottles are white with a white lid and a gold border label. The bottle contains 60 fish gelatin softgel dietary supplements.&nbsp; &nbsp; &nbsp;The California Gold Nutrition Women’s Multivitamin and Women’s 50+ Multivitamin both have dark purple packaging with a gold border label. Both products contain 60 capsules in foil within the packaging. The following batch numbers and expiration dates for the products are printed on the back of the package near the bottom of package/sleeve.&nbsp;ProductsBatch CodesExpiration DatesDaily Prenatal Multi2307050A, 2404096A, 2411100A08/2025, 05/2026, 11/2026Ultamins Women’s MultivitaminV0532, V053311/2026, 07/2026Ultamins Women’s 50+ MultivitaminV0534, V053607/2026, 11/2026","The recalled dietary supplements contain iron, which must be in child-resistant packaging, as required by the&nbsp;https://www.cpsc.gov/Poison-Prevention-Packaging-Act"">Poison Prevention Packaging Act. The iron-containing dietary supplement packages violate the federal standard for child-resistant packaging because the bottles and blister packs are not child-resistant, posing a risk of deadly poisoning, if the contents are swallowed by young children.",,,Refund,"About 60,000","None reported","Consumers should immediately secure the recalled supplement bottles out of sight and reach of children and contact iHerb for a refund and information on how to safely discard the packaging and product. To receive a refund, consumers should email ProductRecall@iherb.com with the subject line: “Iron Supplement Refund” and provide the following information:&nbsp;NameProduct(s) name &amp; quantity orderedEvidence of destruction: initial and date each product package and include a photo with your initials and the date visibleOptional: Provide the order number associated with the purchase(s), which can be found by logging into consumer’s account and viewing the “Order History”.&nbsp;iHerb is contacting all known purchasers directly.","Sold At","Online at Amazon.com, Walmart.com, Target.com and other websites from January 2019 through April 2025 for between $8 and $18.",,"iHerb LLC, dba Madre Labs LLC, of Irvine, California",,"United States",,
25223,,"April 10, 2025",,"Kramer Laboratories Recalls Safetussin Max Strength Multi-Symptom Cough, Cold and Flu Blister Packs Due to Risk of Child Poisoning; Violation of Federal Regulation for Child Resistant Packaging","Safetussin Max Strength Multi-Symptom Cough, Cold and Flu tablets blister packs","This recall involves Safetussin Max Strength Multi-Symptom Cough, Cold and Flu 24-count caplet blister packs. They are labeled with “Safetussin,” “Multi-Symptom,” “Cough, Cold &amp; Flu” and “Safe for adults with High Blood Pressure, Diabetes.” They were sold in a blue, orange and red cardboard box with the drug facts label on the back.","The Safetussin over-the-counter cold medicine contains acetaminophen, which must be in child-resistant packaging as required by the Poison Prevention Packaging Act. The packaging of the products is not child-resistant as a tablet can be pushed through the foil, posing a risk of poisoning if the contents are swallowed by young children.",,,Refund,"About 14,250","None reported","Consumers should immediately secure the product out of the sight and reach of children and contact Kramer Laboratories for information on how to return or dispose of the product for a full refund. Only the packaging is being recalled, not the medicine itself, but both should be disposed.","Sold At","HEB, Harris-Teeter and other regional grocery stores and independently owned pharmacies nationwide from July 2024 through March 2025 for about $11.",,,"Kramer Laboratories, of Bridgewater, New Jersey (a subsidiary of Arcadia Consumer Healthcare, of Bridgewater, New Jersey)",India,,
25201,,"March 27, 2025",,"NFH Iron Dietary Supplement Bottles Recalled Due to Risk of Poisoning; Violation of Federal Regulation for Child Resistant Packaging; Imported by Nutritional Fundamentals for Health (NFH)","NFH Iron SAP, NFH Heme Iron SAP and NFH Prenatal SAP bottles","This recall involves NFH Dietary Supplement bottles for Iron SAP, Heme Iron SAP and Prenatal SAP. The bottles are white with the brand name “NFH” and the firm’s logo of a leaf in blue. The date code is on the bottom of the bottle. The recalled dietary supplement bottles have the following description and come in various sizes:Product NameDescriptionSizesDate CodesIron SAPIron Glycinate60 Capsules (1029U)120 Capsules(1167U)60 capsules&nbsp;5398705/31/20275398805/31/20275398512/31/20265398612/31/20265398306/30/20265398406/30/2026N00274 07/31/2025120 capsules&nbsp;538975/31/2027539875/31/2027539885/31/20275398512/31/20265398612/31/2026539846/30/2026N00274 6/30/2025Heme Iron SAP (Porcine)&nbsp;Superior Absorption and Bioavailability60 Capsules(1124U)N00265 - 03/31/202553809 - 05/31/202653810 - 07/31/2026&nbsp; &nbsp; &nbsp;57807 - 10/30/202653811 - 10/31/202657806 - 10/31/202662379 - 08/31/2027Prenatal SAPMultivitamin&nbsp;180 Capsules(1034U)5821709/30/20275822009/30/20275736105/31/20275736905/31/20275737005/31/20275737205/31/20275821405/31/20275396803/31/20275719401/31/20275736001/31/20275396311/30/20265396411/30/20265396511/30/20265396611/30/20265396711/30/20265395410/31/20265395610/31/20265395810/31/20265396010/31/20265396110/31/20265396210/31/20265395307/31/20265394605/31/20265394504/30/2026N00287 08/31/2025N00285 04/30/2025N00284 03/31/2025","The recalled dietary supplements contain iron, which must be in child-resistant packaging, as required by the Poison Prevention Packaging Act (PPPA). The packaging is not child-resistant, posing a risk of poisoning if the contents are swallowed by young children.",,,Replace,"About 17,660","None reported","Consumers should immediately secure the recalled supplement bottles out of sight and reach of children, and contact NFH for information on how to obtain a free replacement child-resistant bottle. NFH is contacting all known purchasers directly. This recall only includes the bottle.","Sold At","Multiple naturopathic/homeopathic clinics nationwide, A Woman's Time and Doctor Supplement stores, and online at WholescriptsInc.com and Natural Partners (Fullscript.com) from March 2022 through December 2024 for between $20 and $95, depending on the product and the size.","Nutritional Fundamentals for Health (dba NFH), of Canada","Nutritional Fundamentals for Health (dba NFH), of Canada",,Canada,,
25194,,"March 20, 2025",,"Arsell Recalls Benadryl Liquid Elixir 100 mL Bottle Due to Risk of Child Poisoning; Violation of Federal Regulation for Child Resistant Packaging; Sold on Amazon.com","Benadryl Liquid Elixir, 100 mL bottles","This recall involves Benadryl Liquid Elixir sold in a round dark plastic bottle with a pink and white label on the front with the word “Benadryl” in blue text. The product contains 100 mL of Benadryl. The back label contains safety disclosures, storage instructions and manufacturer information. The product was packaged in a paper box decorated with pink and white with the word “Benadryl” written in blue text. The package has a white label on the bottom with the following code written in black text: “X003VRIGUL.”","The Benadryl contains diphenhydramine, which must be in child-resistant packaging as required by the Poison Prevention Packaging Act. The packaging of the products is not child-resistant, posing a risk of poisoning if the contents are swallowed by young children.",,,Refund,"About 2,300","None reported","Consumers should immediately secure the Benadryl out of the sight and reach of children and contact Arsell for a full refund. Consumers will be asked to submit their Amazon order number and a photo demonstrating disposal of the recalled Benadryl to&nbsp;recall@arsellsupport.com. Only the bottle is being recalled, not the medicine itself, but both should be disposed of. All known purchasers are being contacted directly.","Sold At","Sold online at Amazon.com from July 2023 through October 2024 for between $16 and $19.","Arsell Inc., of Brooklyn, New York",,,Canada,,
25183,,"March 13, 2025",,"Gerolsteiner Sparkling Water Bottles Recalled Due to Laceration Hazard; Manufactured by Gerolsteiner","Gerolsteiner 750ml Sparkling Water Bottles","This recall involves&nbsp;Gerolsteiner 750ml sparkling water bottles from two specific lots. The water was sold in large 750ml glass bottles or in cases containing 15 bottles. There is a white, blue and red label on the front of the bottle with the name “Gerolsteiner”. The lot number is located on the lower part of the label. Affected bottles have a lot number 11/28/2024 L or 11/27/2024 L.","The recalled water bottles can crack, causing a laceration hazard.",,,Refund,"About 61,500 bottles","None reported","Consumers should immediately stop using the recalled Gerolsteiner sparkling water bottles, and return the bottles from the affected lots to the store where they were purchased for a full refund. Consumers will not be asked for proof of purchase, but will need to return the recalled bottle to receive a refund (in the form of cash or credit).","Sold At","Trader Joe’s stores in Alabama, Arkansas, Colorado, Florida, Georgia, Kansas, Louisiana, New Mexico, Oklahoma, South Carolina, Tennessee and Texas from December 2024 through January 2025 for about $3 per bottle.",,"Gerolsteiner Brunnen GmbH &amp; Co. KG, of Germany",,Germany,,
25173,,"March 06, 2025",,"Taylor Water Technologies Recalls Phosphate Reagent Bottles Sold with Test Kits Due to Risk of Severe Chemical Burns; Violation of Federal Regulation for Child-Resistant Packaging","Phosphate Reagent #1 Bottles sold within the Taylor Phosphate Test Kits","This recall involves the replacement reagent #1 bottles sold with Taylor Phosphate Test Kits #K-1106 and also sold separately. The kits are used to test the level of phosphate in water for pools, spas and aquariums. The water testing kits are labeled with the brand name “Taylor,” the kit name “Phosphate Test” and part number “K-1106.” The bottle in the kit that contains sulfuric acid is labeled with the brand name “Taylor,” product name “Phosphate Reagent #1,” part number “R-0980” and “A Size: 22 mL (.75 oz).” The replacement reagent bottle that is sold separately has the same label. Phosphate Reagent #1 has a shelf-life of 24 months.&nbsp;&nbsp;","The recalled Taylor Water Technologies reagent bottles sold with test kits contain sulfuric acid, which must be in child-resistant packaging, as required by the Poison Prevention Packaging Act (PPPA). The packaging for the bottle with sulfuric acid is not child resistant, posing a risk of chemical burns to the skin or eyes and internal corrosive burns, if ingested.",,,Replace,"About 10,000","None reported","Consumers should stop using the recalled Phosphate Reagent #1 bottles immediately, place them in a safe and secure location away from the reach of children and contact Taylor Water Technologies for information on how to properly dispose of the recalled bottle and obtain a free replacement bottle. Only unexpired Phosphate Reagent #1 bottles are included in this recall and eligible for the free replacement. Taylor Water Technologies is contacting all known purchasers directly.","Sold At","Online at www.taylortechnologies.com and other websites and in pool and aquarium stores nationwide from August 2022 through August 2024 for about $13 for the reagent bottles and $56 for the kits that include the reagent bottles.",,"Taylor Water Technologies LLC, of Sparks, Maryland",,"United States",,
