25110,,"January 30, 2025",,"Cabinet Health Recalls 4 oz. Refillable Medicine Bottles Due to Failure to Retain Child-Resistance; Risk of Child Poisoning","Cabinet Health 4 oz. Refillable Medicine Bottles","This recall involves certain Cabinet Health 4 oz. Refillable Medicine Bottles with ABS plastic lids. The bottles are made of clear glass with blue, turquoise, orange or purple plastic lids labeled “CABINET.” Cabinet Health sold the bottles filled with over-the-counter drugs or as empty 4 oz. bottles.&nbsp;The recalled empty 4 oz. bottles were sold via cabinethealth.com from March 2023 through July 2024. Consumers with recalled empty bottles can identify them by the date of purchase. The recalled bottles filled with over-the-counter drugs have the following date codes on a sticker on the bottom of the bottle.Medication NameLid ColorDate CodesTension Headache - Refillable Glass Bottle (Acetaminophen 500mg Caffeine 65mg) - 100 CountBlue2029J072232029J076232029J07723Allergy Relief - Refillable Glass Bottle (Diphenhydramine HCl 25mg) - 120 CountTurquoise2265J07323Pain Reliever and Nighttime Sleep Aid - Refillable Glass Bottle (Acetaminophen 500mg, Diphenhydramine 25mg) - 120 CountBlue2127J068232127J233233040J233233051J233233051J23423Pain Reliever and Fever Reducer - Refillable Glass Bottle (Acetaminophen 500mg) - 120 CountBlue2286J063232286J065232286J066232287J066232287J06723Cough Relief - Refillable Glass Bottle (Dextromethorphan Hbr 15mg) - 60 CountOrange2010J069232010J070233004J296233010J296233025J29623Sleep Aid - Refillable Glass Bottle (Diphenhydramine HCl 50mg) - 70 CountPurple3021J068233021J069233034J234233034J23523","The plastic lid’s closure can degrade after repeated openings, causing the lid’s child-resistance to diminish, posing a risk of poisoning, if the contents are swallowed by young children.",,,Replace,"About 65,000 ","None reported.","Consumers should immediately secure the recalled bottles out of the sight and reach of children and contact Cabinet Health for a free replacement lid. Consumers will be asked to submit a photo demonstrating the destruction of the recalled lid. Cabinet Health and Amazon are contacting all known purchasers directly. This recall does not affect the medication within the bottles.","Sold At","Online at cabinethealth.com, Amazon.com and Grove.co and at CVS stores from March 2023 through July 2024 for between $10 and $20.",,"Cabinet Health Inc., of Washington, D.C.&nbsp;",,China,,
25081,,"January 02, 2025",,"Euqee Wintergreen Essential Oils Recalled Due to Risk of Poisoning; Violation of the Poison Prevention Packaging Act; Sold Exclusively on Amazon.com by DLWL-US","Euqee Wintergreen Essential Oils","This recall involves Euqee Wintergreen Essential Oil Bottles. The oil was sold in amber glass bottles with a black screw-on cap in the size of 118 ml. “Euqee, Essential Oil, Premium Grade, 100% Pure Plant Extract and Wintergreen” is printed on a white label on the front of the bottle. The back label contains safety disclosures, storage instructions and manufacturer information.","The essential oil contains methyl salicylate, which must be in child-resistant packaging, as required by the Poison Prevention Packaging Act (PPPA). The packaging for the products is not child-resistant, posing a risk of poisoning if the contents are swallowed by young children. &nbsp;",,,Refund,"About 3,750","None reported","Consumers should immediately secure the recalled essential oil out of the sight and reach of children and contact DLWL-US for a full refund. Consumers can request a pre-paid label and free packaging to return the Euqee Wintergreen Essential Oil. DLWL-US and Amazon.com are contacting all known purchasers directly.","Sold At","Amazon.com from December 2023 through August 2024 for about $8.",,,,China,Retailer:,"DingLinWangLuoKeJiGuang ZhouYouXianGongSi, dba DLWL-US, of China"
24192,,"April 11, 2024",,"BRS Liquid Fuel Bottles Recalled Due to Risk of Poisoning and Burn Hazard; Violation of the Children’s Gasoline Burn Prevention Act; Sold Exclusively on Amazon.com by Huenco","BRS Liquid Fuel Bottles","This recall involves BRS portable liquid fuel bottles sold individually. The BRS bottle is orange with a black cap and was sold in 530mL, 750mL and 1000mL sizes. “BRS” the bottle’s volume, warnings, and/or directions appear in white lettering on the bottles.","The portable fuel bottles do not meet the child-resistant requirements for closures under the Children's Gasoline Burn Prevention Act (CGBPA). The closure for the products is not child-resistant, posing a risk of burn and poisoning to children.",,,Refund,"About 1,600","None reported","Consumers should immediately stop using the recalled fuel bottles, place them out of reach of children, and contact Huenco for instructions on how to dispose of the product to receive a full refund.","Sold At","Amazon.com from October 2018 through December 2023 for about $15.",,,,China,Retailer:,"Huenco, of China"
24190,,"April 11, 2024",,"Yoto Recalls Yoto Mini Speakers for Children Due to Burn and Fire Hazards","Yoto Mini speakers","This recall involves the Yoto Mini, a portable connected screen-free speaker intended for children ages three to twelve. The Yoto Mini is operated by use of Yoto cards and is designed to play audiobooks, music, radio, and podcasts. The speakers are pale gray with orange tactile controls and a pixel display. The model name Yoto Mini, SKU PRPLXX00860, and serial number are located on the base of the product. The recalled Yoto Mini was sold with a charging cable included, but no adaptor or charger.","The speaker’s lithium-ion battery can overheat and catch fire, posing burn and fire hazards to consumers.",,,Repair,"About 251,165 (In addition, about 18,932 were sold in Canada)","Yoto has received six reports from U.S. consumers and one from a UK consumer of the speaker overheating or melting. No injuries have been reported.","Consumers should immediately stop using the recalled speakers, take them away from children, and contact Yoto to receive a free replacement smart charging cable. Consumers can send a photograph of the old cable cut through the middle to receive a new replacement cord.","Sold At","Online at us.yotoplay.com, Amazon.com, Target.com and maisonette.com, and in toy and gift stores nationwide from November 2021 through April 2024 for about $70.","Yoto Inc., of New York",,,China,,
24189,,"April 05, 2024",,"Procter & Gamble Recalls 8.2 Million Defective Bags of Tide, Gain, Ace and Ariel Laundry Detergent Packets Distributed in US Due to Risk of Serious Injury","Tide Pods, Gain Flings, Ace Pods and Ariel Pods liquid laundry detergent packets packaged in flexible film bags. This recall announcement applies only to bags distributed in the United States.","This recall involves certain lot codes of Tide Pods, Gain Flings, Ace Pods, and Ariel Pods liquid laundry detergent packets packaged in flexible film bags that were manufactured between September 2023 and February 2024. Recalled products range from bags with 12 to 39 laundry detergent packets and include the following:&nbsp;Gain Flings Original&nbsp;Tide Simply Pods Plus Oxi Boost&nbsp;Gain Flings Moonlight Breeze Scent&nbsp;Tide Pods Clean Breeze Scent&nbsp;Gain Flings Blissful Breeze Scent&nbsp;Tide Pods Free &amp; Gentle&nbsp;Gain Flings Spring Daydream Scent&nbsp;Tide Pods Oxi&nbsp;Gain Flings Plus Ultra Oxi&nbsp;Tide Pods Ultra Oxi&nbsp;Gain Flings Plus Odor Defense&nbsp;Ace Pods Clean Breeze&nbsp;Tide Pods Original&nbsp;Ace Pods Spring Meadow&nbsp;Tide Pods Spring Meadow Scent&nbsp;Ariel Pods Alpine Breeze&nbsp;Tide Pods Light&nbsp;&nbsp;","The outer packaging meant to prevent access to the contents can split open near the zipper track, posing a risk of serious injury to children and other vulnerable populations if the contents of the laundry detergent packets are ingested, as well as posing a risk of skin or eye injuries. Ingestion of a large quantity of any surfactant-containing household cleaning products can cause death among individuals with underlying health issues.",,,"Refund, Replace","About 8.2 million (In addition, about 56,741 were sold in Canada)","No confirmed cases directly relating to this packaging defect. The firm has received four reports of children in the United States accessing the liquid laundry packets, three of which reported ingestion during the time period that the recalled lots were sold, but it is not known if these laundry packets came from recalled bags.","Consumers should immediately secure the recalled bags out of sight and reach of children and contact Procter &amp; Gamble for a full refund and a free replacement child-resistant bag to store the product. Consumers can also receive a cabinet lock for securing laundry materials.&nbsp;Consumers should check to see if their bag is part of the recall by checking the lot code on their bag.&nbsp; Recalled lot codes will be listed at pg.com/bags and are found on the bottom of the package.&nbsp; Consumers with recalled bags can submit a photo of the recalled product, showing the lot code to participate in the recall.","Sold At","Big Lots, CVS, Family Dollar, Home Depot, Sam’s Club, Target, Walmart, and other major stores nationwide and online at Amazon.com and other websites from September 2023 through present for between $5 (one 12 ct. bag) and $30 (four 39 ct. bags in a box).",,"The Procter &amp; Gamble Company, of Cincinnati, Ohio",,"United States",,
24172,,"March 21, 2024",,"BRS and BULin Liquid Fuel Bottles Recalled Due to Risk of Burn and Poisoning; Violation of the Children’s Burn Prevention Safety Act; Sold Exclusively on Amazon.com by Tentock","BRS and BULin Liquid Fuel Bottles","This recall involves BRS and BULin portable liquid fuel bottles sold individually. The BRS bottle is orange with a black cap and was sold only in a 1000mL size.&nbsp; The BULin bottle is red with a red cap and was sold only in a 1000mL size. Its text is in Chinese. “BRS” or “BULin,” and the bottle’s volume, warnings, and/or directions appear in white lettering on the bottles.","The portable fuel containers violate the child-resistant requirements for closures under the Children's Gasoline Burn Prevention Act (CGBPA). The closure for the products is not child resistant, posing a risk of burns and poisoning to children.",,,Refund,"About 290","None reported","Consumers should immediately stop using the recalled fuel bottles, place them out of reach to children, and contact Tentock for instructions on how to dispose of the product to receive a full refund.","Sold At","Amazon.com from January 2023 through December 2023 for between $10 and $13.",,,,China,Retailer:,"Tentock, of China"
