"Recall Number","Product Safety Warning Number",Date,"Product Safety Warning Date","Recall Heading","Name of product",Description,"Hazard Description","Consumer Action","Original Product Safety Warning Announcement","Remedy Type",Units,Incidents,Remedy,"Sold At Label","Sold At",Importers,Manufacturers,Distributors,"Manufactured In","Custom Label","Custom Field"
26169,,"January 08, 2026",,"The Kalencom Corporation Recalls SARO Braided Crib Bumpers Due to Risk of Serious Injury or Death from Suffocation; Violates Federal Crib Bumper Ban","SARO Braided Crib Bumpers","This recall involves SARO Braided Crib Bumpers, Model 1374. The crib bumpers were sold in salmon, gray and mint colors. “Ref. 1374” is printed on a tag sewn into the crib bumpers and on a tag attached to the product packaging.","The recalled padded crib bumpers violate the federal ban on crib bumpers because they can obstruct an infant’s breathing, posing a risk of serious injury or death, due to suffocation.&nbsp;This creates an unsafe sleeping environment for infants. Padded crib bumpers are banned by the federal&nbsp;https://www.cpsc.gov/Business--Manufacturing/Business-Education/Busines… Sleep for Babies Act.",,,Refund,"About 55","None reported","Consumers should stop using the crib bumpers immediately and request a full refund in one of the following ways:For SARO Braided Crib Bumpers purchased in store at MacroBaby in Orlando, Florida, consumers should return the item to the store for a refund.&nbsp; &nbsp;&nbsp;For SARO Braided Crib Bumpers purchased online, consumers should email&nbsp;info@kalencom.com with the subject line “Crib Bumper Recall – Refund Request” and include name and phone number, along with a photo showing the crib bumper cut in half as proof of destruction.&nbsp;","Sold At","MacroBaby, of Orlando, Florida and online at Kalencombaby.com and Target.com from May 2024 through October 2025 for about $60.","The Kalencom Corporation, of New Orleans, Louisiana",,,China,,
26132,,"December 04, 2025",,"Little Pea Shop Crib Bumpers Recalled Due to Risk of Serious Injury or Death from Suffocation; Violates Federal Crib Bumper Ban; Sold by Little Pea Shop","Little Pea Shop Crib Bumpers","This recall involves two styles of Little Pea Shop-branded padded crib bumpers. The “Waffle Bedding Accessory” style was sold as bumper pads in gray, pink, blue and white and in four different lengths: 23.5 inches, 47 inches, 78.5 inches and 94.5 inches. The “Plush Crib Bumper” style was sold as vertical crib slat covers with Velcro in beige and ivory in the shape of bears and rabbits or a star pattern.","The recalled crib bumpers violate the federal crib bumper ban because they can obstruct an infant’s breathing, posing a risk of serious injury or death, due to suffocation. This creates an unsafe sleeping environment for infants. Padded crib bumpers are banned by the https://www.cpsc.gov/Newsroom/News-Releases/2023/CPSC-Approves-Rules-Im… lang=""EN-US"">Safe Sleep for Babies Act.",,,Refund,"About 300","None reported","Consumers should immediately stop using the recalled crib bumpers and contact Little Pea Shop for a full refund. Consumers should remove the crib bumpers, cut the padding and email a photo of the destroyed bumpers to support@littlepeashop.com.","Sold Online At","littlepeashop.com from October 2023 through October 2025 for between $30 and $80.",,,,China,Retailer:,"Little Pea Shop, of France"
25473,,"September 18, 2025",,"LXDHSTRA Baby Loungers and Crib Bumpers Recalled Due to Risk of Serious Injury or Death from Suffocation and Fall Hazards; Violates Federal Standard for Infant Sleep Products and Federal Crib Bumper Ban; Sold on Amazon","LXDHSTRA Baby Loungers","This recall involves LXDHSTRA-branded baby loungers. The recalled baby loungers include a foam sleeping pad and padded bumpers with a cloth cover. The baby loungers were sold in the following prints: tan star, big elephant, green elephant, gray feather and gray rainbow; and came with a red and black padded crib bumper that has letters “A” through “F” on one side and animal characters on the other side.","The recalled baby loungers violate the mandatory standard for&nbsp;https://www.cpsc.gov/Business--Manufacturing/Business-Education/Busines… Sleep Products. The sides are too low to contain an infant. The sleeping pad is too thick, posing a suffocation hazard. The enclosed openings at the foot of the loungers are wider than allowed, posing a fall hazard and an entrapment hazard to infants. Also, the baby loungers do not have a stand, posing a fall hazard if it is used on elevated surfaces. These violations create an unsafe sleeping environment for infants and can cause death or serious injury to infants.In addition, the recalled baby loungers come with crib bumpers, which are banned by the Federal&nbsp;https://www.cpsc.gov/Business--Manufacturing/Business-Education/Busines… Sleep for Babies Act because the padded crib bumpers can obstruct breathing,&nbsp;posing a risk of serious injury or death to infants from&nbsp;suffocation.",,,Refund,"About 360","None reported","Consumers should immediately stop using the recalled baby loungers and crib bumpers and contact LXDHSTRA for a full refund. Consumers should remove the foam and pads from the baby lounger’s cover and cut the cover, foam, pad, and crib bumper in half. Consumers should email photos of the destroyed baby lounger and crib bumper to&nbsp;lxdhstrarecall@gmail.com to obtain a full refund.","Sold At","Amazon from May 2025 through August 2025 for between $30 and $34.",,,,China,Retailer:,"Shenzhenshilongxingdashangmaoyouxiangongsi, dba LXDHSTRA, of China"
25384,,"July 10, 2025",,"AUGNORYE Padded Crib Bumpers Recalled Due to Risk of Serious Injury or Death from Suffocation; Violates Federal Crib Bumper Ban; Sold on Amazon by YIXIA","AUGNORYE Padded Cushioned Crib Bumpers","This recall involves&nbsp;AUGNORYE&nbsp;padded cushioned crib bumpers. The polyester pink bumpers were sold in four pieces and measure approximately 27 inches by 9.6 inches, and 52 inches by 9.6 inches. There is a care label with a series of letters and numbers stitched to the crib bumper.","The recalled&nbsp;padded cushioned crib bumpers violate the federal crib bumper ban because they can obstruct&nbsp;an infant’s breathing,&nbsp;posing a&nbsp;suffocation hazard. This creates an unsafe sleeping environment for infants. Padded crib&nbsp;bumpers&nbsp;are banned by the&nbsp;https://www.cpsc.gov/Newsroom/News-Releases/2023/CPSC-Approves-Rules-Im… Sleep for Babies Act.",,,Refund,"About 356","None reported","Consumers should immediately stop using the recalled padded cushioned crib bumpers and contact YIXIA for a full refund. Consumers should remove the crib bumpers, cut the straps and padding and email a photo of the destroyed bumpers to&nbsp;Yixiakejirecall@163.com to obtain a full refund. YIXIA and Amazon are contacting all known purchasers directly.","Sold Exclusively Online","Amazon from February 2025 through May 2025 for between $40 and $45.",,,,China,Retailer:,"Shenzhenshi Yixiakejiyouxiangongsi, dba YIXIA, of China"
25383,,"July 10, 2025",,"Braided Crib Bumpers Recalled Due to Risk of Serious Injury or Death from Suffocation; Violates Federal Crib Bumper Ban; Sold on Amazon by Haoyunm","Braided crib bumpers","This recall involves braided crib bumpers. They are sold in multiple colors and have sizes in 39 inches, 59 inches, 78 inches, 118 inches and 158 inches long. They come in a vacuum sealed bag. There are no markings or labeling on the crib bumpers.","The recalled crib bumpers violate the federal ban on crib bumpers because the padded crib bumpers can obstruct breathing,&nbsp;posing a risk of serious injury or death to infants from&nbsp;suffocation. Padded crib bumpers are banned by the Federal Safe Sleep for Babies Act.",,,Refund,"About 260","None reported","Consumers should stop using the crib bumpers, remove them from the crib immediately and contact Haoyunm for a refund. Consumers should cut the bumper in half, take a photo of it, and email the photo to&nbsp;hyzhongtshung@outlook.com.","Sold Online At","Amazon from December 2024 through April 2025 for between $25 and $115.",,,,China,Retailer:,"Fang Cheng Xian Hao Yun Shang Mao You Xian Gong Si, dba Haoyunm, of China&nbsp;"
25172,,"March 06, 2025",,"Love Our Home Braided Crib Bumpers Recalled Due to Risk of Serious Injury or Death from Suffocation Hazard; Violation of Federal Ban on Crib Bumpers; Sold Exclusively on Shein.com by Love Our Home","Love Our Home Braided Crib Bumpers","This recall involves Love Our Home&nbsp;crib bumpers. The braided pink bumpers were sold in lengths of one, two, three and four meters or 3.28, 6.56, 9.84 or 13.12 feet.","The recalled crib bumpers violate the federal crib bumper ban, posing a deadly suffocation hazard to infants. Padded crib bumpers are banned by the federal Safe Sleep for Babies Act.",,,Refund,"About 750","None reported","Consumers should immediately stop using and remove the recalled crib bumpers from the crib. To receive a full refund, consumers should cut the crib bumper in half, take a photo of it, and email the photo to&nbsp;loveourhomerecall@163.com. Love Our Home is contacting all known purchasers directly.","Sold Exclusively Online","Shein.com from March 2024 through November 2024 for between $11 and $36.",,,,China,Retailer:,"Shenzhen Comfort Dream Home Textiles Co. LTD, dba Love Our Home, of China"
25033,,"November 07, 2024",,"Baofali Crib Bumpers Recalled Due to Suffocation Hazard; Violation of Federal Ban on Crib Bumpers; Sold Exclusively on Temu.com by Unique Person Home Goods","Baofali 4-in-1 Microfiber Crib Safety Bumpers","This recall involves Baofali 4-in-1 Microfiber Crib Safety Bumpers with model numbers JJ25B-A1, JJ25B-A2 and JJ25B-A3. They are sold in white, gray and pink colors and have a rectangular shape with fabric ties attached. They are approximately 52 inches long by 10 inches tall.","The recalled crib bumpers violate the federal crib bumper ban, posing a suffocation hazard to infants. Padded crib bumpers are banned by the federal Safe Sleep for Babies Act.",,,Refund,"About 390","None reported.","Consumers should immediately stop using and remove the recalled crib bumpers from the crib. To receive a full refund, take a photo of the crib bumper cut in half and email the photo to 2540535966@qq.com or message to&nbsp;Baofali Trading on Temu.com. Dispose of the destroyed crib bumper in accordance with local and state laws. Baofali Trading is contacting all known purchasers directly.","Sold At","Exclusively online at Temu.com from June 2024 through August 2024 for between $25 and $30.",,,,China,Retailer:,"Baofali Trading Co. Ltd., dba Unique Person Home Goods,&nbsp;of China"
24246,,"May 30, 2024",,"Crib Bumpers Recalled Due to Suffocation Hazard; Violation of Federal Crib Bumper Ban; Sold by Henan Ouchang Trading and Xinxiang Junshun Trading on AliExpress and Recalled by AliExpress","Crib Bumpers","This recall involves padded crib bumpers sold in the following colors: gray with white clouds, teddy bear, light pink, and white. They were sold in a clear plastic bag. There are no markings or labeling on the crib bumpers.","Infants can suffocate if they roll or move on the crib bumper in a position that obstructs breathing. Padded crib bumpers are banned under federal law.",,,Refund,"About 75","None reported.","Consumers should immediately stop using the recalled crib bumpers and contact AliExpress for a full refund. To receive a refund, consumers should destroy the crib bumpers by cutting the straps and the padding and send a photo as proof of destruction by directly replying to the email from AliExpress. AliExpress is contacting all known purchasers.","Sold At","Online at Aliexpress.com from October 2023 through February 2024 for about $174 (Henan Ouchang Trading Co., Ltd.) and from December 2023 through February 2024 for about $26 (Xinxiang Junshun Trading Co., Ltd).",,,,China,Retailers:,"Henan Ouchang Trading Co. Ltd. and Xinxiang Junshun Trading Co. Ltd., of China"
24185,,"April 04, 2024",,"Zazaba International Recalls Grão de Gente Crib Bumpers Due to Suffocation Hazard; Violation of Federal Crib Bumper Ban; Sold Exclusively on Zazaba.com","Grão de Gente Crib Bumper Bedding Sets","This recall involves padded crib bumpers sold within multi-piece crib bedding sets. The crib bumpers were sold with different printed fabrics, colors, and designs, including safari, astronaut, elephant, and balloon themes. The table below lists the SKU and product name of each crib bumper bedding set included in the recall. “Grão de gente” is printed on a tag sewn onto some of the pieces in each crib bedding set.SKUProduct Name13721410-Piece Safari Baby Crib Bedding Set12247311-Piece Pink Little Elephant and the Balloon Crib Bedding Set14314013-Piece Astronaut Buddies Crib Bedding Set12198613-Piece Sweet Charm Crib Bedding Set1564106-Piece Blue Braided Starry Crib Bedding Set1682996-Piece Boho Rainbow Crib Bedding Set1404726-Piece Braided Blue Dreamer Elephant Crib Bedding Set1407336-Piece Gray and Yellow Sleepy Bear Braided Crib Bedding Set1564286-Piece Gray Braided Starry Crib Bedding Set1561016-Piece Pink Braided Starry Crib Bedding Set1404746-Piece Pink Dreamer Elephant Braided Crib Bedding Set1560996-Piece Pink Heart Braided Crib Bedding Set1548496-Piece Watercolor Safari Braided Crib Bedding Set1564116-Piece Yellow and Gray Braided Starry Crib Bedding Set1209247-Piece Classic Princess Crib Bedding Set929527-Piece Classic White Crib Bedding Set929587-Piece Royal Teddy Bear Crib Bedding Set942007-Piece Straw Classic Teddy Bear Crib Bedding Set1634059-Piece Astronaut Wolf Crib Bedding Set1038759-Piece Blue Braided Polka Crib Bedding Set960259-Piece Blue Luxury Knitted Crib Bedding Set998189-Piece Classic Princess Crib Bedding Set1495769-Piece Gray Baby Elephant Braided Crib Bedding Set1386659-Piece Green Polka Braided Crib Bedding Set1148109-Piece Luxury White Knitted Crib Bedding Set1038809-Piece Navy Blue Chevron Braided Crib Bedding Set1042529-Piece Navy Blue Luxury Crib Bedding Set1386589-Piece Navy Blue Polka Braided Crib Bedding Set826449-Piece Pink Angel Crib Bedding Set1038859-Piece Pink Braided Polka Crib Bedding Set997019-Piece Pink Love Rain Crib Bedding Set1451259-Piece Pink Unicorn Braided Crib Bedding Set","Infants can suffocate if they roll or move on the crib bumper in a position that obstructs breathing. Padded crib bumpers are banned under&nbsp;the&nbsp;https://www.cpsc.gov/Business--Manufacturing/Business-Education/Busines… Sleep for Babies Act of 2021.",,,Refund,"About 795","None reported","Consumers should immediately stop using the recalled Grão de Gente crib bumpers and contact Zazaba International Inc. for instructions on how to properly dispose of the product and receive a full refund. Zazaba International Inc. is contacting all known consumers directly.The crib sheets, quilts, mosquito nets, and other non-crib-bumper items included in the bedding sets are not banned under the Safe Sleep for Babies Act of 2021. However, parents and caregivers are reminded to use a fitted sheet only, and never add blankets, pillows, padded crib bumpers, or other items to an infant’s sleeping environment.","Sold At","Online at Zazaba.com from March 2023 through August 2023 for between $24 and $220.","Zazaba International Inc., of Dania Beach, Florida",,,Brazil,,
