"Recall Number","Product Safety Warning Number",Date,"Product Safety Warning Date","Recall Heading","Name of product",Description,"Hazard Description","Consumer Action","Original Product Safety Warning Announcement","Remedy Type",Units,Incidents,Remedy,"Sold At Label","Sold At",Importers,Manufacturers,Distributors,"Manufactured In","Custom Label","Custom Field"
26-289,,"February 26, 2026",,"Magnetic Chess Games Recalled Due to Risk of Serious Injury or Death from Magnet Ingestion; Violates Mandatory Standard for Toys; Sold on Amazon by Kaiwenshangpin","Magnetic Chess Games","This recall involves magnetic chess games with magnets that are small, loose and separable with a strong magnetic flux. The games are sold in a blue box with the words “Magnetic”, “Magnetic Chess Piece” and “Intelligence Strategy Game” on the front of the box.&nbsp;The game includes 20 loose magnets, a yellow string, gameplay instructions and a plastic storage bag.","The recalled magnetic chess games violate the&nbsp;https://www.ecfr.gov/current/title-16/chapter-II/subchapter-B/part-1250… standard for toys because they contain loose magnets posing an ingestion hazard to children. When high-powered magnets are swallowed, the ingested magnets can attract each other, or other metal objects, and become lodged in the digestive system. This can result in perforations, twisting, and/or blockage of the intestines, blood poisoning and death.",,,Refund,"About 1,300","None reported","Consumers should stop using the recalled magnetic chess games immediately, take them away from children, and dispose of them. To receive a full refund, consumers will be asked to email a photo of the disposal to&nbsp;Kaiwenshangpinrecall@outlook.com.","Sold Online At","Amazon.com from August 2025 to November 2025 for about $13.","Yiwushixiuxiangfushiyouxiangongsi (“Yiwu Xiu Xiang Garment Co., Ltd.”) dba Kaiwenshangpin, of China ",,,China,,
26-287,,"February 24, 2026",,"Magnetic Chess Games Recalled Due to Risk of Serious Injury or Death from Magnet Ingestion; Violate Mandatory Standard for Toys; Sold on Amazon by Yiruikeji2024","Christmas-themed Magnetic Chess Games","This recall involves magnetic chess games. The recalled Christmas-themed games consist of 20 magnets, a red string, instructions and a red drawstring storage bag. “Merry Christmas,” and holiday images, including a Santa Claus, snowmen and a Christmas tree, are printed on the front of the game’s box and “Magnetic” is printed on the back.","The recalled magnetic chess games violate the&nbsp;https://www.ecfr.gov/current/title-16/chapter-II/subchapter-B/part-1250… standard for toys because they contain loose magnets posing an ingestion hazard to children. When high-powered magnets are swallowed, the ingested magnets can attract each other, or other metal objects, and become lodged in the digestive system. This can result in perforations, twisting, and/or blockage of the intestines, blood poisoning and death.",,,Refund,"About 5,300","None reported","Consumers should immediately stop using the recalled magnetic chess games, take them away from children and contact Yiruikeji2024 for a full refund. Consumers will be asked to send a photo of the disposed product to&nbsp;yirui2024@yeah.net.","Sold Online At","Amazon.com from November 2024 through November 2025 for about $7.","Shenzhenshiyiruikejiyouxiangongsi (Shenzhenshi Yirui Technology Co., Ltd.), dba Yiruikeji2024, of China",,,China,,
26-265,,"February 12, 2026",,"Surveying Accessories Cheaper Recalls Board Games Due to Risk of Serious Injury or Death from Magnet Ingestion; Violates Mandatory Standard for Toys","Colombia-themed Magnetic Board Games","This recall involves Colombia-themed magnetic board games. The recalled games consist of a two-sided board with a storage bag and 32 multi-colored magnetic pieces and two dice with one storage pouch. The original packaging included a piece of chocolate. “Colombia que linda eres” is printed on the game’s board. “Cositas Colombianas” is printed on the front of storage box. Only the four-and six-player versions of the board games are included in this recall.","The recalled board games violate the mandatory standard for toys because the magnetic game pieces contain loose&nbsp;high-powered magnets, posing an ingestion hazard to children. When high-powered magnets are swallowed, the ingested magnets can attract each other, or other metal objects, and become lodged in the digestive system. This can result in perforations, twisting, and/or blockage of the intestines, blood poisoning and death.",,,Refund,"About 1,200","None reported","Consumers should immediately stop using the recalled magnetic board games and take them away from children. Consumers should contact Surveying Accessories Cheaper for a pre-paid shipping label to return the board games for a full refund in the form of the original form of payment or check.","Sold At","Centro Envíos Aventura in Miami, Florida and online at Amazon.com from April 2023 through June 2025 for between $20 and $50.",,,,Colombia,Retailer:,"Surveying Accessories Cheaper, of Miami, Florida"
25-221,,"April 10, 2025",,"Multifunctional Puzzle Crab Toys Recalled Due to Risk of Serious Injury or Death from Ingestion Hazard; Violation of Federal Regulations for Toy Magnets; Sold Exclusively on Walmart.com by JinJiang Baimei","Multifunctional Puzzle Crab Toys","This recall involves Mulfunctional Puzzle Crab Toys, which include a magnetic fish hook, 8 magnetic pieces, 4 plastic puzzle pieces, and a plastic mallet. The model “HY-99” is located on the bottom of the box. The multicolor sets are sold in a box with the label “Multifunctional Puzzle” on the front and back.","The recalled magnetic Multifunctional Puzzle Crab Toy set violates the mandatory federal regulation for magnet toys, posing an ingestion hazard. When high-powered magnets are swallowed, the ingested magnets can attract each other, or another metal object, and become lodged in the digestive system. This can result in perforations, twisting and/or blockage of the intestines, infection, blood poisoning and&nbsp;death.",,,Refund,About 600,"None reported","Consumers should stop using the recalled&nbsp;Multifunctional Puzzle Crab Toy immediately, keep it away from children and contact JinJiang Baimei to receive a pre-paid label to return the recalled magnetic pieces for a full refund. JinJiang Baimei and Walmart.com are notifying all known purchasers directly.","Sold At","Exclusively online at Walmart.com from November 2023 through January 2025 for about $27.","Lucky Bird Inc., of Buffalo, New York",,,China,Retailer:,"JinJiang Baimei&nbsp;Co. Ltd, of China"
25-134,,"February 13, 2025",,"6-in-1 Pounding Games Recalled Due to Ingestion Hazard; Violation of Federal Regulations for Magnets; Sold Exclusively on Temu.com by DMITOY","6-in-1 Pounding Games","This recall involves the 6-in-1 Pounding Game that consists of a wooden frame with a frog clock on each end. One side of the game has a xylophone, and the other side has three colorful gears. The top of the game has circular holes and wooden pegs with animal faces that pop up and down. The game comes with a set of wooden carrots and worms with metal heads that fit in the holes. Two wooden mallets, two wooden sticks, and a wooden bird are included with the game. The bird has a strong magnet embedded in its beak and can break off.","The recalled 6-in-1 Pounding Game violates the mandatory federal regulation for magnets because it contains a magnet that can become loose, posing an ingestion hazard to children. When high-powered magnets are swallowed, the ingested magnets can attract each other, or another metal object, and become lodged in the digestive system. This can result in perforations, twisting and/or blockage of the intestines, infection, blood poisoning and death.",,,Refund,About 180,"None reported","Consumers should stop using the recalled pounding games immediately and take them away from children. To receive a full refund, please dispose of the product so it is out of the reach of children, take a photo of the disposal, and send it to DMITOY via email at dmitoy202405@163.com or message it to DMITOY on Temu.com. DMITOY is notifying all known purchasers directly.","Sold At","Exclusively online at Temu.com from May 2024 through July 2024 for about $20.",,,,China,Retailer:,"DMITOY, of China"
24-265,,"June 13, 2024",,"Magnetic Chess Games Recalled Due to Ingestion Hazard; Violation of Federal Regulations for Toy Magnets; Sold Exclusively on Temu.com through Outad Good Life","1 Set Puzzle “Magnetic”, “Magnetism”, or “Magnetism Intelligence Strategy Game” Magnetic Battle Chess Games","This recall involves magnetic chess games with 20 magnet stones that are small, spherical, loose, and separable with a strong magnetic flux. The games are sold in a blue box with the words “Magnetic”, “Magnetism”, or “Magnetism Intelligence Strategy Game” on the front of the box. The game includes about 20 loose magnets, a string, a plastic storage tray with sponge lining, and instructions for play.","The recalled magnetic chess games, which include 20 magnet pieces, violate the mandatory federal toy magnet regulation because the set contains one or more magnets that fit within CPSC’s small parts cylinder, and the magnets are stronger than permitted. When high-powered magnets are swallowed, the ingested magnets can attract each other, or another metal object, and become lodged in the digestive system. This can result in perforations, twisting and/or blockage of the intestines, infection, blood poisoning and death.",,,Refund,"About 2,600","None reported. CPSC estimates 2,400 magnet ingestions were treated in hospital emergency departments from 2017 through 2021. CPSC is aware of seven deaths since 2005 involving the ingestion of hazardous magnets, including two outside of the United States.","Consumers should stop using the recalled magnetic chess games immediately, take them away from children, and contact Outad Good Life for instructions on how to receive a full refund. Consumers can also visit their Temu account, find the relevant order in “Your Orders” and click on the “Return/Refund” button. Follow the detailed instructions on the Return and Refund Policy page on Temu.com to receive a return shipping label to send back the recalled products for free. Outad Good Life is notifying all known purchasers directly.","Sold At","Exclusively online at Temu.com from December 2023 through February 2024 for about $8.",,,,China,Seller:,"Outad Good Life Ltd., of China"
24-098,,"February 01, 2024",,"Lovevery Recalls Slide & Seek Ball Runs with Wooden Knobs Due to Choking Hazard","Slide & Seek Ball Runs with Wooden Knobs","This recall involves certain units of the 2023 Slide &amp; Seek Ball Runs, which are wooden toys with a plastic ball ramp that is included in Lovevery’s Babbler Play Kits for children aged 13 to 15 months. The recalled units of the Ball Run have a wooden knob on the door, do not have a Lovevery logo engraved on the bottom, and do not have a green sticker on the inside wall of the door with the wooden knob.&nbsp;","The packaging configuration can allow damage to the wooden knob on the Ball Run during shipping and cause it to come loose and detach, posing a choking hazard to children.",,,Replace,"About 47,000 (In addition, about 4,500 were sold in Canada)","Lovevery has received 33 reports of the wooden knob detaching during shipping and six reports of the wooden knob detaching after shipment. No injuries have been reported.","Consumers with a recalled ball run should immediately take it away from children, stop using it, and contact Lovevery for a free replacement. Consumers will receive a free replacement after registering on the firm’s website, removing and marking the affected door with a specific case number (which will be emailed to known purchasers), uploading a photo of their marked door to&nbsp;www.recallrtr.com/ballrun, and affirming to Lovevery that the door will be disposed of in the trash. Lovevery is contacting all known purchasers directly.","Sold At","Online at Lovevery.com as part of the Babbler Play Kit from June 2023 through November 2023 for about $120 for the kit.","Lovevery Inc., of Boise, Idaho",,,China,,
24-096,,"February 01, 2024",,"Huihuang Trading Recalls Fishing Games Due to Magnet Ingestion Hazard, Violation of the Federal Safety Regulation for Toys; Sold Exclusively on Amazon.com","Fishing Games","This recall involves Huihuang Trading Inc. Fishing Games. The game includes about nine animal pieces to fish with, in addition to four toy fishing rods, four toy fishing nets, a set of four markers, instructions to play the game, and a waterproof storage bag. Batch number&nbsp;X002903XZT323 is printed on the side of the game’s box.","The fishing game does not comply with the requirements of the mandatory federal toy regulation because it contains one or more magnets that fit within CPSC’s small parts cylinder and the magnets are stronger than permitted. When high-powered magnets are swallowed, the ingested magnets can attract to each other, or another metal object, and become lodged in the digestive system. This can result in perforations, twisting and/or blockage of the intestines, infection, blood poisoning and death.",,,Refund,"About 200","None reported. CPSC estimates 2,400 magnet ingestions were treated in hospital emergency departments from 2017 through 2021. CPSC is aware of seven deaths since 2005 involving the ingestion of hazardous magnets, including two outside of the United States. ","Consumers should stop using the recalled fishing game immediately, take it away from children and contact Huihuang Trading to receive a pre-paid label to return the recalled products. Upon receipt of the products, consumers will receive a full refund. Huihuang Trading Inc. is notifying all known purchasers directly.","Sold At","Exclusively online at Amazon.com from June 2023 through July 2023 for between $20 and $25.","Huihuang Trading Inc., of Parker, Colorado",,,China,,