"Recall Number","Product Safety Warning Number",Date,"Product Safety Warning Date","Recall Heading","Name of product",Description,"Hazard Description","Consumer Action","Original Product Safety Warning Announcement","Remedy Type",Units,Incidents,Remedy,"Sold At Label","Sold At",Importers,Manufacturers,Distributors,"Manufactured In","Custom Label","Custom Field"
26293,,"February 26, 2026",,"TheKiddoSpace Recalls Children’s Handwriting Practice Kits Due to Risk of Injury from Lead Exposure; Violates Federal Lead Content Ban","TheKiddoSpace Print and Cursive Handwriting Kits","This recall involves two different types of TheKiddoSpace-branded handwriting practice kits sold with or without a carrying case:&nbsp;The block handwriting kits consist of four reusable books with animal images on the cover (alphabet with a bunny, numbers with a frog, math with a cow and drawing with an elephant); black pens; blue, green, yellow, purple, pink and red pen grips; and pen refills. TheKiddoSpace logo and “Handwriting Practice Kit” are printed on the blue and white book covers and their storage box.&nbsp;&nbsp;&nbsp;The cursive handwriting kits consist of three reusable books (letters, words and sentences) with an image of an open book on the cover; black pens; blue, green, yellow, purple, pink and red pen grips; and pen refills. TheKiddoSpace logo and “Cursive Practice Kit” are printed on the blue and white book covers and their storage box. &nbsp;","The pens in the recalled children’s handwriting kits contain levels of lead in the nib that exceed the federal https://cpsc.gov/Business--Manufacturing/Business-Education/Lead/Total-… lang=""EN-US"">lead content ban. Lead is toxic if ingested by young children and can cause adverse health issues.",,,Replace,"About 19,700","None reported","Consumers should stop using the recalled handwriting kits immediately, take the pens and refills away from children and contact The KiddoSpace to receive free replacement pens and refills, including shipping. Consumers will be asked to dispose of the pens and refills according to local and state regulations and send a photo of the disposed products to info@thekiddospace.com.","Sold Online At","TheKiddoSpaceStore.com and Amazon.com from February 2024 through February 2025 for between $25 and $50.","SN Commerce LLC, dba TheKiddoSpaceStore, of Dover, Delaware",,,China,,
25388,,"July 17, 2025",,"Primark Recalls DTR Stitch 4-pack Scented Highlighters Due to Risk of Phthalate Exposure; Violates Federal Phthalates Ban; Sold by Primark","Primark DTR (direct-to-retail) Stitch Scented Highlighters (4-pack)","This recall involves the DTR Stitch Scented Highlighters 4-pack in yellow, blue, pink and green colors. The highlighters are shaped like slushie containers with a drinking straw. Each highlighter portrays a Stitch character. The product’s Kimball Number is 0688701 and can be found on the price tag located at the back of the packaging.&nbsp;","The scented highlighters, which resemble cups with straws, contain phthalates; a violation of the federal phthalates ban. Phthalates are toxic if ingested by young children and can cause adverse health effects.",,,Refund,"About 2,600","None reported","Consumers should immediately stop using the recalled scented highlighters and return them to a Primark store for a full refund in the form of the original payment.&nbsp;","Sold Exclusively At","Primark stores located in the northeast and in Florida, Maryland and Illinois from May 2024 through May 2025 for $5.","Primark US Corp., of Boston, Massachusetts",,,China,,
25254,,"May 08, 2025",,"Yamaha Corporation of America Recalls Power Adaptors for Digital Pianos and Music Workstations Due to Burn and Fire Hazards","YAMAHA PA-300C AC Power Adaptors","This recall involves Yamaha-brand AC adaptors with model number PA-300C that were sold with Yamaha-brand arranger workstations, digital pianos, and music control panels, as well as Steinberg-brand audio interfaces.&nbsp;The AC power adaptors are black and have the model name, the model number, the efficiency level, and the serial number printed on the AC adaptor rating label. The recalled adaptors were manufactured from July 2010 through May 2012. The fifth character in the serial number corresponds to the year the product was manufactured, while the sixth character corresponds to the month that the product was manufactured. For example, XXXX24XXXXX corresponds to April 2012. The power adaptors were sold separately as a service part and also built into certain Yamaha-brand Clavinova digital pianos.Recalled AC Power Adaptors:BrandModel NumberModel NameSerial Number&nbsp;Efficiency Level&nbsp;YAMAHAPA-300CAC ADAPTORXXXX0XXXXXXVYAMAHAPA-300CAC ADAPTORXXXX1XXXXXXVYAMAHAPA-300CAC ADAPTORXXXX21XXXXXVYAMAHAPA-300CAC ADAPTORXXXX22XXXXXVYAMAHAPA-300CAC ADAPTORXXXX23XXXXXVYAMAHAPA-300CAC ADAPTORXXXX24XXXXXVYAMAHAPA-300CAC ADAPTORXXXX25XXXXXVClavinova® digital pianos with recalled power adaptors built in:BrandModel NumberModel NameSerial Number RangeYAMAHACLP-430RClavinova Digital PianoUCQ******UCR******UCS******UCTH*****UCTI*****YAMAHACLP-430BClavinova Digital PianoUCQ******UCR******UCS******UCTH*****UCTI*****YAMAHACLP-430MClavinova Digital PianoUCQ******UCR******UCS******UCTH*****UCTI*****YAMAHACLP-430PEClavinova Digital PianoUCQ******UCR******UCS******UCTH*****UCTI*****YAMAHACVP-601BClavinova Digital PianoUCS******UCTH*****UCTI*****YAMAHACVP-601PEClavinova Digital PianoUCS******UCTH*****UCTI*****","The AC power adaptors can overheat and ignite, posing burn and fire hazards.&nbsp;",,,"Replace, Repair","About 37,400","The firm has received four reports of adaptors burning or smoking. No injuries have been reported.","Consumers should immediately stop using and unplug the recalled PA-300C AC Power Adaptor and contact Yamaha Corporation of America for a free replacement adaptor. Visit&nbsp;www.yamaha.com/us/support/pa300crecall/ for instructions to participate in the recall. Consumers will need to submit their information through an online form or by email, and will need to submit evidence of product destruction with their claim. Consumers should not damage their recalled adaptor until they have read the recall instructions online.Consumers who own a Yamaha-brand Clavinova® digital piano with a recalled adaptor&nbsp;should unplug the piano and contact Yamaha.&nbsp;Yamaha will provide piano technician services to perform an on-site inspection of the piano and provide a free replacement adaptor.","Sold At","Music stores nationwide and online including www.shop.usa.yamaha.com from September 2010 through November 2014, and, separately, as a service repair part, for about $70.","Yamaha Corporation of America, of Buena Park, California",,,China,,
25125,,"February 06, 2025",,"Jazwares Recalls America’s Got Talent Microphones with Lithium-Ion Batteries Due to Fire Hazard","America’s Got Talent microphones","This recall involves the America’s Got Talent (AGT) microphone sold under the First Act brand. The microphone amplifies the user’s voice and has treble, bass and echo switches. The microphone is black with the AGT logo on the front, measures 10.5 inches long and weighs approximately one pound. There is an integrated speaker below the microphone with a power button and control button in the back. The microphones are powered by a rechargeable non-removable lithium-ion battery. The SKU numbers AGT0002 (microphone only) and TMS0002 (microphone and poster) are located on the bottom of the integrated speaker.Note:&nbsp;Recalled lithium-ion batteries should be disposed of in accordance with any local and state ordinances, following the procedures established by your municipal recycling center for damaged/defective/recalled lithium batteries, because these potentially hazardous batteries must be handled differently than other batteries. Do not dispose of this recalled product that has lithium-ion batteries in the trash. Do not deposit this recalled product in used battery recycling boxes found at various retail and home improvement stores.&nbsp;","The lithium-ion batteries in the recalled microphones can overcharge and ignite, posing a fire hazard.",,,Refund,"About 125,000 (In addition, about six were sold in Canada)","The firm has received three reports of the lithium-ion batteries igniting, resulting in smoke and fire damage to walls and floors.  No injuries have been reported.","Consumers should immediately stop using the recalled microphones and contact Jazwares for a full refund. Consumers will receive their refund in the form of a pre-paid gift card. After registering for the recall, consumers should dispose of the microphone in accordance with local and state regulations and not in the ordinary trash.","Sold At","Meijer, DD's Discounts/Ross, Target and Walmart stores nationwide, Nebraska Furniture Mart stores in Nebraska, Iowa, Texas and Kansas and online at www.Amazon.com and www.Target.com from October 2020 through October 2022 for between $20 and $25.","Jazwares LLC, of Sunrise, Florida",,,China,,
24337,,"August 08, 2024",,"Chem-Pak Recalls Finger-Ease Guitar String Lubricants Due to Skin Irritation Hazard","Finger-Ease Guitar String Lubricants","This recall involves one production batch of Finger-Ease Guitar String Lubricant. The product is a clear aerosol spray sold in a white-color steel can with a black cap. The product measures about 1.5 inches long, 1.5 inches wide and 6 inches tall, and weighs about 4.5 ounces. The product has a picture of a brown guitar with the words “Tone Finger Ease Guitar String Lubricant” in brown, black and red lettering. There is a red horizontal stripe on the can. Printed on the can is “Manufactured by Chem-Pak, Inc.”, and the production batch code is printed in black ink on the bottom of the steel container with model number 220B and lot code 106824.","The recalled guitar string lubricant contains a contaminant, posing a risk of skin irritation.",,,Replace,"About 21,130","The firm has received one report of minor skin irritation.","Consumers should immediately stop using the recalled guitar lubricant and contact Chem-Pak to receive a free replacement. Do not empty the product prior to disposal or pour the product down the toilet or drain. Consumers should mark the bottom of the product with the word “Recalled” and the date in permanent marker, then upload a photo of marked product, the product’s model number and lot code, and a photo of the disposed product in the trash, and submit the photo online at&nbsp;https://chem-pak.com/productrecalls/. Upon successful registration, the firm will issue a replacement to purchasers.","Sold At","Sweetwater, Guitar Center and U.S. Band &amp; Orchestra Supplies stores nationwide, and online at Amazon.com, MusiciansFriend.com and StLouisMusic.com from March 2024 through May 2024 for between $7 and $9.",,"Chem-Pak Inc., of Martinsburg, West Virginia",,"United States",,
24224,,"May 02, 2024",,"Bausch + Lomb Recalls Project Watson Eyelid Wipes for Dogs Due to Risk of Exposure to Bacteria and Fungi","Project Watson Eyelid Wipes for Dogs","This recall involves two lots of Project Watson Eyelid Wipes (45 count) for dogs, which are packaged in a small round container with a twist-on lid and blue and white labeling. “PROJECT WATSON” and “BAUSCH + LOMB” are printed on the label. One of two recalled lot numbers, A09050 and A10055, is printed on the bottom of the container.","When the recalled dog eyelid wipes are opened and in use, bacteria and fungi, which are organisms found widely in the environment, soil, and water, can be introduced and grow in the container, posing a risk of serious infection to people with weakened immune systems. Individuals with wounds may also be at higher risk of infection. People with healthy immune systems are not typically affected.",,,Refund,"About 32,000","The company has received seven reports of a substance developing in the container after the product had been opened and in use. No illness of consumers or pets has been reported.","Consumers should immediately stop using the recalled eyelid wipes and request a full refund by submitting a picture of their product via an online form at&nbsp;http://eyelidwiperecall.com/.&nbsp;The refund will be in the form of a check sent to consumers via U.S. mail.&nbsp;Consumers should then dispose of the product in its container with household trash.","Sold At","PetSmart, Walmart, and other stores nationwide, and online at Chewy.com and Amazon.com from February 2023 through March 2024 for between $13 and $15.",,,"Bausch & Lomb Americas Inc., of Bridgewater, New Jersey","United States",,
24221,,"May 02, 2024",,"Dixon Ticonderoga Recalls Creativity Street Foam Pattern Rollers Due to Violation of Federal Lead Content Ban","Creativity Street Foam Pattern Rollers","This recall involves Creativity Street Foam Pattern Rollers with model PAC5170, which are intended for children to use when painting. Lot codes “02142080423” and “02142230523” are included in the recall and are printed on the back of the packaging. The foam pattern rollers come in four assorted patterns, with yellow, green, blue, and red handles.","The recalled foam pattern rollers are intended for children and contain levels of lead that exceed the federal lead content ban in the rollers’ handles. Lead is toxic if ingested by young children and can cause adverse health effects.",,,Refund,"About 2,880 (In addition, 24 in Canada)","None reported.","Consumers should immediately stop using the recalled foam pattern rollers and take them away from children. Contact Dixon Ticonderoga to receive a pre-paid label to return the recalled product. When the foam pattern rollers are received, consumers will receive a full refund. All known purchasers are being contacted directly by the firm or retailer.","Sold At","Online at Amazon.com, StaplesAdvantage.com, MacPhersonsArt.com, ADASales.com and Walmart.com, and at the Teacher’s Edition store in Brooklyn, New York, from September 2023 through January 2024 for about $15.","Dixon Ticonderoga Company, of Appleton, Wisconsin",,,China,,
