"Recall Number","Product Safety Warning Number",Date,"Product Safety Warning Date","Recall Heading","Name of product",Description,"Hazard Description","Consumer Action","Original Product Safety Warning Announcement","Remedy Type",Units,Incidents,Remedy,"Sold At Label","Sold At",Importers,Manufacturers,Distributors,"Manufactured In","Custom Label","Custom Field"
25121,,"February 06, 2025",,"Doosan Bobcat North America Recalls Bobcat & Steiner AirFX Finish Mower Deck Attachments Due to Crush Hazard","Bobcat & Steiner AirFX Finish Mower Deck attachments","This recall involves Bobcat &amp; Steiner AirFX Finish Mower Deck attachments. The mower decks are all black and labeled with “AirFX” and either “72” or “61” depending on the mower deck model. The following model numbers, located on the rear of the attachment on the right-side frame rail, are included in this recall.&nbsp;Model NumberDescription752657572"" AirFX752657961"" AirFX744922361"" AirFx Finish Mower744734172"" AirFx Finish Mower&nbsp;","The recalled mower decks cannot be secured in the upright or tilted position by the locking pins during maintenance or service, posing a crush hazard.",,,"Inspect, New Instructions, Repair","About 552 (In addition, about 27 were sold in Canada) ","The firm is aware of five incidents where the locking pins were unable to be installed to secure the deck in the upright or tilted position. No injuries have been reported.","Consumers should immediately inspect and determine whether locking pins can be inserted while the deck is in the upright or tilted position during maintenance or service. Contact Doosan Bobcat North America or a Bobcat dealer to obtain a free repair, which will be available in the near future. Until then, if the locking pins cannot be inserted, obtain two straps, each rated for 1,500 lbs., and wrap a strap around each front tractor axle, securing each strap to the mower deck when performing service or maintenance. Consumers should contact Doosan if they are unable to obtain straps, and straps will be provided at no cost to the consumer.&nbsp;Doosan Bobcat North America is contacting all known purchasers.&nbsp;","Sold At","Bobcat and Steiner dealers nationwide from April 2023 through September 2024 for between $5,200 and $5,500.&nbsp;",,"Doosan Bobcat North America, of West Fargo, North Dakota",,"United States",,
25127,,"February 06, 2025",,"TTI Outdoor Power Equipment Recalls RYOBI Battery-Powered Mowers Due to Fire Hazard","RYOBI 40-Volt Brushless 21” Cordless Walk-Behind Mowers","This recall involves certain RYOBI Brushless 21” Cordless Walk-Behind Self-Propelled Multi-Blade Push Mowers (40V HP). The mowers have a black cutting deck with gray top housing along with a black bag with “RYOBI” printed on it. The recall only includes model numbers RY401014BTLUS, RY401014US, RY401140US, RY401015BTLUS, RY401015US, RY401150US, RY401140US-Y, RY401150US-Y, RY401020, and RY401200 with the following serial numbers: KC21032D010001 - KC21327N999999. The model and serial numbers can be found on the mowers inside the green mower housing.","The recalled mowers have a push-on connector inside the powerhead that can overheat, posing a fire hazard.",,,Replace,"About 217,500 (In addition, about 28,400 were sold in Canada)","TTI has received 97 reports of overheating while the mower was in use, including five reports of fires. Two minor burn injuries have been reported.","Consumers should immediately stop using the recalled mower and contact TTI Outdoor Power Equipment Inc. (“TTI”) for instructions on how to disable the recalled mower and receive a free replacement 21” walk-behind mower.","Sold At","Home Depot and Direct Tools Factory Outlet stores nationwide, and online at www.homedepot.com and www.directtoolsoutlet.com from February 2021 through January 2025 for between $500 and $700.",,"TTI Outdoor Power Equipment Inc., of Anderson, South Carolina",,"United States",,
25083,,"January 02, 2025",,"Kawasaki Motors USA Recalls John Deere ZTrak Zero Turn Mowers with Kawasaki Engines Due to Fire and Burn Hazards","John Deere ZTrak™ Zero Turn Mowers with Kawasaki Engines","This recall involves John Deere ZTrak Zero Turn Mowers with model numbers Z720E, Z730M, Z740R and Z760R with Kawasaki engines. The recalled mowers are green and yellow and have the model number and “John Deere” printed on the front of the mower below the seat. The serial number is located on the right side of the machine near the rear tire. The following are the serial number ranges of the mowers included in this recall:&nbsp;ModelStart Serial NumberEnd Serial NumberZ720E1TC720E****0100011TC720E****080657Z730M1TC730M****0100011TC730M****080574Z740R1TC740R****0100011TC740R****080462Z760R1TC760R****0800011TC760R****080339","The voltage regulator in the mower’s engine can fail during use or while the product is being stored, causing the engine to overheat, posing fire and burn hazards.",,,Repair,"About 39,000 (In addition, about 2,600 in Canada)","Kawasaki has received five reports of fires and 26 reports of melting and/or smoking. No injuries have been reported.","Consumers should immediately stop using the recalled mowers and contact an authorized John Deere dealer for a free repair. Kawasaki and John Deere are contacting all known purchasers directly.","Sold At","Authorized John Deere dealers nationwide from October 2018 through September 2024 for between $8,000 and $11,500.",,"Kawasaki Motors Manufacturing Corp. U.S.A. (engine manufacturer), of Maryville, Missouri",,"United States",Retailer:,"Deere &amp; Company, of Moline, Illinois"
24345,,"August 15, 2024",,"Stanley Black & Decker Recalls DeWALT Battery Walk-Behind Mowers Due to Laceration Hazard","DeWALT Battery Push walk-behind mowers and DeWALT Battery Self-Propelled walk-behind mowers","This recall involves 2024 model year DeWALT Battery 21” Push walk-behind mowers, model numbers DCMWP234U2 and DCMWP600X2, and DeWALT Battery 21” Self-Propelled walk-behind mowers, model numbers DCMWSP256U2 and DCMWSP650Y2. The mowers are black, gray and yellow and have DeWALT printed in yellow on the front or side of the mower. The model number is printed on the rear door of the mower. A date code formatted as 20XX&nbsp;YY-58, with 20XX for year, YY for week, and 58 as the factory code, is laser-printed in yellow on the left side of the mower, just above the left rear wheel. Only date codes 2023 32-58 through 2024 13-58 are affected. Mowers manufactured after March 2024 (2024 14-58) are not affected.","If water gets into the mower’s handle support while the battery is installed, the mower can fail to shut off when the bail handle is released or start without a key, posing a laceration hazard to the user.",,,Repair,"About 46,200 (In addition, about 9,600 were sold in Canada)","The firm has received 10 reports of mowers failing to shut off when the bail handle is released and one report of a mower starting without a key inserted. The incident in which a mower started without a key inserted resulted in a finger laceration for which no medical attention was required.","Consumers should immediately stop using the recalled mowers if the mower has gotten wet and contact DeWALT to receive a free repair at an authorized service center nearby.","Sold At","The Home Depot, Tractor Supply, Ace Hardware and various stores nationwide and online at www.homedepot.com, www.tractorsupply.com and www.acehardware.com from January 2024 through July 2024 for between $530 and $750.",,"Stanley Black and Decker Inc., of New Britain, Connecticut",,China,,
24256,,"June 06, 2024",,"Kawasaki Motors USA Recalls Engines Used in Bad Boy Mowers, BigDog, Bobcat, Cub Cadet, Hustler, John Deere and Kubota Brand Lawn and Garden Equipment Due to Fire and Burn Hazards","Kawasaki Engines used in Bad Boy Mowers, BigDog, Bobcat, Cub Cadet, Hustler, John Deere, and Kubota brand lawn and garden equipment","This recall involves Kawasaki engines used in lawn and garden equipment sold under the Bad Boy Mowers brand name with mower models Rebel BRB54FX850, Rebel BRB6135KA, Rebel BRB61FX850, Rebel BRB7235KA, Revolt BRV54FX850, Revolt BRV61FX850, Rogue BRG5435KA, Rogue BRG6135KA, Rogue BRG61RD35KA, and Rogue BRG72RD35KA; under the BigDog brand name with mower model Stout MP; under the Bobcat brand name with mower models ZT6000, ZT6100, and ZT7000; under the Cub Cadet brand name with mower model ZTX-6; under the Hustler brand name with mower model FasTrak SDX; under the John Deere brand name with mower model Z760R, utility vehicle models Gator TX 4x2 and Gator TS 4x2, and some service engines for model year 2016-2020 lawn tractor models X350R, X350, X354, X370 X380, X384, X390 and X394; and under the Kubota brand name with mower model Z726XKW.&nbsp;The recalled engines are model year 2021-2023 FJ400D, FS600V, FS651V, FX691V, FX730V, FX801V, FX850V and FXT00V. The recalled engine model and serial numbers are located on the engine fan housing. The following model and serial number ranges are included in this recall.Recalled Kawasaki Engines&nbsp;Engine Model NumberSpecification NumberEngine Serial Number RangeFJ400DES04A full list of serial numbers included in this recall are on the firm’s website at&nbsp;www.kawasakienginesusa.com/product-recall.html.&nbsp;FS04FS600VDS20DS21FS651VHS05JS05FX691VFS18GS18FX730VFS17GS17FX801VCS25DS25GS13HS13KS08LS08MS08FX850VES24FS13FS15FS24GS15GS24FXT00VAS25BS25BS31","The recalled engines can overheat, posing fire and burn hazards.",,,Repair,"About 68,500 (In addition, 900 in Canada)","Kawasaki has received eight reports of fires with the recalled engines. No injuries have been reported.","Consumers should immediately stop using lawn and garden equipment with the recalled engines and contact Kawasaki, John Deere, Cub Cadet, Hustler, BigDog or Kubota, depending on the product owned, or an authorized dealer, to schedule a free repair. Kawasaki and the mower manufacturers are contacting all known purchasers directly.","Sold At","Kawasaki, Bad Boy Mowers, BigDog, Bobcat, Cub Cadet, Hustler, John Deere and Kubota dealers nationwide from April 2021 through December 2023 for between $4,000 and $15,500.",,"Kawasaki Motors Manufacturing Corp. U.S.A., of Maryville, Missouri",,"United States",,
24220,,"May 02, 2024",,"American Honda Motor Expands Recall of Lawnmowers and Pressure Washer Engines to include Lawnmower Replacement Engines Due to Injury Hazard; Additional Units/Injuries Reported","Honda Lawnmowers, Replacement Engines, and Pressure Washers Engines","This recall involves Honda HRN216 and HRX217K6 lawnmowers, and GCV170/200 G5B general-purpose engines used in power washers and lawnmower replacement engines. The gas-fueled walk-behind lawnmowers are red and black with “HONDA” written on the clipping collection bag. The model and serial number are printed on a label located on the upper rear of the mower deck. The pressure washer engines are mounted on various original equipment manufacturer frames. The serial number of the engine is engraved on a flat spot on the engine. The lawnmower replacement engines are used to replace the existing engines on the Honda HRN216 and HRX217K6 lawnmowers. The serial number of the lawnmower replacement engine is engraved on a flat spot on the engine.","The improperly manufactured camshafts in the engines can cause the starter rope to suddenly retract when pulling to start, posing an injury hazard.",,,Repair,"About 200 additional lawnmower replacement engines (About 391,800 Lawnmowers and Pressure Washers Engines were previously recalled in September 2023)","Honda has received 2,966 reports of incidents related to camshaft failures since the last recall, in addition to the 2,197 reported incidents in the September 2023 recall, including 38 reports of minor injuries.","Consumers should immediately stop using the recalled lawnmowers and recalled pressure washers equipped with the recalled general-purpose engines, and contact an authorized Honda Power Equipment dealer to schedule an appointment for a free inspection and repair.","Sold At","Honda Power Equipment dealers, Ace Hardware, Home Depot, Lowes, Northern Tool, and various farm, agricultural, and rental stores nationwide from May 2022 through June 2023 for between $550 and $1,100.",,"American Honda Motor Co. Inc., of Torrance, California",,"United States",,
