"Recall Number","Product Safety Warning Number",Date,"Product Safety Warning Date","Recall Heading","Name of product",Description,"Hazard Description","Consumer Action","Original Product Safety Warning Announcement","Remedy Type",Units,Incidents,Remedy,"Sold At Label","Sold At",Importers,Manufacturers,Distributors,"Manufactured In","Custom Label","Custom Field"
26-285,,"February 26, 2026",,"Somgem Pig and Yomin Toilet Lighters Recalled Due to Risk of Serious Injury or Death from Fire and Burn Hazards; Violates Mandatory Standard for Cigarette Lighters; Sold on Amazon by Elepdv","Somgem Lightweight Tiny Pinky Pig and Yomin Toilet Lighters","This recall involves Somgem Lightweight Tiny Pinky Pig and Yomin Toilet Lighters. The Somgem-branded lighter comes in the shape of a pink pig with the ignition trigger on the top. The Yomin-branded lighter comes in the shape of a white toilet with a cap on top of the tank and a bottle opener on the bottom of the lighter. The Somgem-branded lighter is 1.18 inches in height and the Yomin-branded lighter is 3 inches in height.","The recalled pig and toilet lighters violate the mandatory standard for&nbsp;https://www.cpsc.gov/Business--Manufacturing/Business-Education/Busines… lighters&nbsp;because they do not have the required child-resistant mechanisms, posing a serious risk of injury or death from fire and burn hazards.The lighters also failed to meet the pre-market lighter submission requirement needed to demonstrate&nbsp;that&nbsp;the&nbsp;lighters&nbsp;feature&nbsp;child-resistant&nbsp;mechanisms&nbsp;and&nbsp;ensuring&nbsp;their&nbsp;safety&nbsp;and compliance with U.S. regulations.",,,Refund,"About 11,710","None reported","Consumers should stop using the recalled lighters immediately and contact Elepdv for a full refund. Consumers will be asked to send a photo of the disabled lighter showing “Recalled” written on it to&nbsp;elepdv@163.com to receive a full refund. Consumers should dispose of the recalled lighters in accordance with state and local waste disposal procedures.","Sold Online At","Amazon.com from July 2022 through November 2025 for between $8 and $13.",,,,China,Retailer:,"Shenzhen Elephant Outdoor Information Technology Inc. dba Elepdv, of China"
26-284,,"February 26, 2026",,"Royal Oak Enterprises Recalls Lighters Due to Risk of Serious Injury or Death from Fire and Burn Hazards; Violates Mandatory Standard for Multipurpose Lighters","Royal Oak Flame Saber Lighters","This recall involves Royal Oak flame saber lighters. The lighters are red with a black-and-gray checkered grip and have a hands-free operation lock. The lighter bears the warning labels, “DANGER: Extremely Flammable, Content Under Pressure” and “WARNING: Only store in locked position” on the sides of the lighter. The “Royal Oak” logo is printed on the front of lighter.","The recalled lighters violate the mandatory standard for&nbsp;https://www.cpsc.gov/Business--Manufacturing/Business-Education/Busines… lighters because they do not have the required child-resistant mechanisms, posing a risk of serious injury or death from fire and burn hazards. The lighters also&nbsp;violate the labeling requirements under the&nbsp;Federal Hazardous Substances Act by missing required safety information.",,,Refund,"About 190,560","None reported","Consumers should stop using the recalled lighters immediately and contact Royal Oak for a full refund. Consumers will be given instructions on how to destroy the device and submit proof of destruction to receive a refund.","Sold At","Lowe’s, Home Depot, Tractor Supply, Rural King and Ace Hardware stores nationwide and online at Lowes.com, HomeDepot.com, TractorSupply.com, RuralKing.com and AceHardware.com from November 2023 through October 2025 for about $30.",,,"Royal Oak Enterprises, LLC, dba Royal Oak of Roswell, Georgia",China,,
26-206,,"January 22, 2026",,"Topkay Lighters Recalled Due to Risk of Serious Injury or Death from Fire and Burn Hazards; Violates Mandatory Standard for Multipurpose Lighters; Sold on Amazon by Xiyude","Topkay Torch Lighters","This recall involves Topkay Torch Lighters. The metal lighters are black and come in a two-pack. “Honest” is printed on the front of lighter.","The recalled lighters violate the mandatory standard for multipurpose&nbsp;https://www.cpsc.gov/Business--Manufacturing/Business-Education/Busines…; because they do not have the required child-resistant mechanisms, posing a risk of serious injury or death from fire and burn hazards.",,,Refund,"About 7,500","None reported","Consumers should immediately stop using the recalled lighters and contact Xiyude for a full refund. Consumers should destroy the lighters by pulling out the black adjuster knob on the top of the product, then contact&nbsp;BCLighterService@outlook.com and submit a photo of proof of destruction to receive a full refund. Consumers should dispose of the recalled lighters in accordance with state and local waste disposal procedures.","Sold Online At","Amazon from September 2025 through October 2025 for about $15.",,,,China,Retailer:,"Xinyude Shenzhen Keji Youxiangongsi, dba Xiyude, of China"
26-006,,"October 09, 2025",,"Calico Brands Recalls Scripto Premium Torches Due to Risk of Injury or Death from Fires and Burns; Violates Mandatory Standard for Multipurpose Lighters","Scripto® Premium Torch","This recall involves the Scripto® Premium Torch which has a four-position adjustable metal nozzle, adjustable flame, hands free operation lock, black ergonomic non-slip rubber grip, and a metal base with black velvet on the bottom. The UPC number “0-70257-52226-6"" is printed on the back of the product box.","The recalled torches violate the requirements of the mandatory safety standard for multipurpose lighters, posing deadly fire and burn hazards to consumers.",,,Refund,"About 175,000","None reported","Consumers should immediately stop using the recalled torches and return them to the retailer for a full refund or store credit or contact Calico Brands for instructions on how to return the torches and receive a full refund.&nbsp;After contacting Calico Brands, consumers will receive a shipping label and appropriate hazmat packaging to return the torches free of charge.","Sold At","Walmart and Home Depot stores nationwide and online at Walmart.com and Homedepot.com from November 2024 through August 2025 for about $15.","Calico Brands, of Ontario, California",,,China,,
25-012,,"October 17, 2024",,"Oliva Cigars Recalls Cigar Slim Lighters Due to Missing Child Safety Feature, Posing Burn and Fire Hazards; Violations of Federal Regulations for Cigarette Lighters","Nub, Serie V, Cain, and Oliva branded Promotional Cigar Slim Lighters","This recall involves Oliva Cigar Nub, Oliva, Serie V and Cain branded cigar lighters given away as a promotional item for free. The recalled lighters have the brand name printed on one side, measure 3” x 1 ½” x ¼” and are white, brown or red in color.","The recalled lighters do not have child-resistant mechanisms and were not tested to the federal regulatory requirements for child resistance. Young children under 5 years of age could ignite the lighters, posing fire and burn hazards.",,,Dispose,"About 60,000","None reported","Consumers should immediately stop using and dispose of the recalled promotional cigar lighters. Oliva Cigars is contacting all known businesses and wholesalers who could have provided the promotional item to consumers. As the product was given away for free, no refund or replacement will be provided.","Sold At","Given away as promotional items by&nbsp;wholesalers and retailers in their marketing campaigns and in cigar lounges from August 2022 through July 2024.","Oliva Cigars Co. Inc., of Miami Lakes, Florida","Wenzhou LingShuo Smoking Accessories Co. Ltd., of China",,China,,
24-111,,"February 08, 2024",,"VPR Brands Recalls Lighters Due to Missing Child Safety Feature, Posing Burn and Fire Hazards; Violation of the Federal Regulation for Cigarette Lighters","Disposable Lighters","This recall involves Slim Soft and Slim Jet disposable lighters imported by VPR Brands. The products have “DISSIM” imprinted on one side and are 3.5 inches by 1 inch in size. They were sold in black, blue, clear, gray, red, white, and yellow colors, and have a molded circular grip at the bottom.&nbsp;","The lighters do not have child-resistant mechanisms and were not tested to the federal regulatory requirements for child resistance. Young children under 5 years old could ignite the lighters, posing fire and burn hazards.",,,Refund,"About 62,200","None reported","Consumers should stop using the recalled lighters immediately and contact VPR Brands for instructions on how to destroy the device and submit proof of destruction to receive a full refund.","Sold At","Small independent stores nationwide and online at vprbrands.com from September 2022 through November 2023 for about $18.","VPR Brands, of Sunrise, Florida",,,China,,