"Recall Number","Product Safety Warning Number",Date,"Product Safety Warning Date","Recall Heading","Name of product",Description,"Hazard Description","Consumer Action","Original Product Safety Warning Announcement","Remedy Type",Units,Incidents,Remedy,"Sold At Label","Sold At",Importers,Manufacturers,Distributors,"Manufactured In","Custom Label","Custom Field"
26221,,"January 29, 2026",,"Mindbodygreen Recalls Ultimate Multivitamin+ Dietary Supplement Bottles Due to Risk of Serious Injury or Death from Child Poisoning; Violates Mandatory Standard for Child-Resistant Packaging","Ultimate Multivitamin+ Dietary Supplement Bottles","This recall involves Mindbodygreen Ultimate Multivitamin+ dietary supplement bottles with the following UPC, lot numbers and manufacturing dates (Month/Year format). The dietary supplements come in eight-ounce amber glass bottles with black caps, each containing 60 capsules. The UPC, lot numbers and manufacturing dates are printed on the bottle.UPCLot NumberManufacturing Date8500279751770515I109/20210130B201/20220187I208/20220324J210/20220309A312/20220368L212/20220272B302/2023&nbsp;0408H306/20230143A412/20230179C402/2024850027975429402113105/2024403321107/2024408084110/2024A01061103/2025A02121103/2025","The bottles are filled with dietary supplements containing iron, which must be in child-resistant packaging, as required by the https://www.cpsc.gov/Business--Manufacturing/Business-Education/Busines… Prevention Packaging Act. The packaging is not child-resistant, posing a risk of serious injury or death from poisoning if the contents are swallowed by young children.",,,Replace,"About 148,370","None reported","Consumers should immediately secure the recalled bottles out of sight and reach of children and contact Mindbodygreen for a free, child-resistant replacement cap. Once the supplements are secured, consumers can continue to use the supplements as directed.","Sold Online At","Mindbodygreen.com from November 2021 through November 2025 for between $40 and $70, depending on subscription.",,"Arizona Nutritional Supplements, of Chandler, Arizona and VitaQuest, of Caldwell, New Jersey","Mindbodygreen, of Miami, Florida",USA,,
26198,,"January 15, 2026",,"RootStim Recalls Beard Growth Serum Spray Bottles Due to Risk of Serious Injury or Death from Child Poisoning; Violate Mandatory Standard for Child-Resistant Packaging","RootStim Beard Growth Serum, 5% Minoxidil","This recall involves RootStim Beard Growth Serums spray bottles. The serums come in black boxes with orange and white lettering and have an orange mustache icon on its front panel. The boxes have “Beard Growth Treatment” and “5% Minoxidil – Biotin &amp; Rice Water” printed on its front, directions and warnings printed on its sides, and “Distributed By RootStim LLC” on the bottom. The bottles are black with black spray cap, transparent top cap, and an orange and black wraparound label bearing the same information as the box.","The beard growth serum contains minoxidil, which must be in child-resistant packaging, as required by the Poison Prevention Packaging Act. The serum’s packaging is not child-resistant, posing a risk of serious injury or death from poisoning if the contents are swallowed by young children.&nbsp;",,,Replace,"About 16,900","None reported","Consumers should immediately secure the recalled serum bottles out of sight and reach of children, and contact RootStim for instructions on receiving a replacement product. Consumers will be asked to discard the original bottle.&nbsp;","Sold Online At","Amazon.com from November 2024 through September 2025 for about $20.&nbsp;",,"Ronghui Intelligent Manufacturing Technology (Guangzhou) Co., Ltd., of China&nbsp;","RootStim LLC, of Lanham, Maryland",China,,
26182,,"January 15, 2026",,"Ruahouine Hair Growth Serum Bottles Recalled Due to Risk of Serious Injury or Death from Child Poisoning; Violates Mandatory Standard for Child-Resistant Packaging; Sold on Amazon by Ruahouine","Ruahouine Hair Growth Serum Bottles","This recall involves Ruahouine Hair Growth Serum. The serum comes in 60ml (2.11 fl. oz.) transparent amber dropper bottles. “Ruahouine”, “Minoxidil Hair Growth Serum”, and “5% Minoxidil With Biotin” are printed on labels wrapped around the bottles.&nbsp;","The serum bottles contain minoxidil, which must be in child-resistant packaging, as required by the https://www.cpsc.gov/Business--Manufacturing/Business-Education/Busines… lang=""EN-US"">Poison Prevention Packaging Act. The serum’s packaging is not child-resistant, posing a risk of serious injury or death from poisoning if the contents are swallowed by young children.",,,"Refund, Replace","About 25,000","None reported ","Consumers should immediately secure the recalled serum bottles and place them out of sight and reach of children. Contact Ruahouine for instructions on how to destroy the recalled bottles and how to receive a refund or replacement bottle. Consumers will be asked to pour the contents of the bottle into the trash and take a photo of the bottle in the trash and email it to ruahouine@gmail.com.&nbsp;","Sold Online At","Amazon.com from January 2025 through July 2025 for about $10&nbsp;",,,,China,Retailer:,"Ruahouine, of China&nbsp;"
26158,,"December 18, 2025",,"Feel The Beard Recalls Minoxidil Beard Growth Serum Bottles Due to Risk of Serious Injury or Death from Child Poisoning; Violates Mandatory Standard for Child-Resistant Packaging","Feel The Beard Minoxidil Beard Growth Oil for Men","This recall involves Feel The Beard-branded Beard Growth Oil bottles. The beard growth oil comes in a one-ounce dark amber bottle with a black dropper cap. The label wrapped around the beard growth oil and the outer packaging read “Beard Growth Oil,” “Feel The Beard,” and “5% minoxidil with biotin.”","The beard serum contains minoxidil, which must be in child-resistant packaging as required by the&nbsp;https://www.cpsc.gov/Business--Manufacturing/Business-Education/Busines… Prevention Packaging Act. The hair serum’s packaging is not child-resistant, posing a risk of serious injury or death from poisoning if the contents are swallowed by young children.",,,Replace,"About 840","None reported","Consumers should immediately secure the recalled serum bottles out of sight and reach of children, and contact Feel The Beard for instructions on destroying the recalled bottles and receiving a replacement. Consumers will be asked to pour the contents of the bottle into the trash and take a photo of the bottle in the trash and email it to&nbsp;ziyad@feelthebeard.com.","Sold Online At","Amazon.com from April 2025 through September 2025 for about $10.",,,,China,"Manufactured in:",China
26068,,"November 06, 2025",,"F&F Fine Wines Recalls Kirkland Signature Valdobbiadene Prosecco DOCG Bottles sold by Costco Due to Laceration Hazard","Kirkland Signature Valdobbiadene Prosecco DOCG bottles","This recall involves certain glass bottles of Kirkland Signature Valdobbiadene Prosecco DOCG. The UPC is 196633883742 and the Costco Item Number is 1879870. The product was sold in a green bottle with purple foil on the top and a purple label with the words “Kirkland Signature Valdobbiadene Prosecco Superiore DOCG”.","The Prosecco bottles can break or shatter, posing a laceration hazard.",,,Refund,"About 941,400","F&F Fine Wines International, Inc. has received ten reports of the bottles shattering or breaking, resulting in one laceration injury.","Consumers should immediately stop using the recalled bottles and not attempt to open them. Consumers should discard the recalled bottles in their household trash and contact Ethica Wines for instructions on how to obtain a full refund from Costco.","Sold At","Costco stores in IA, IL, IN, KY, MI, MN, MO, ND, NE, OH, SD, and WI from April 2025 through August 2025 for about $8.","F&F Fine Wines International, Inc. dba Ethica Wines, of Miami, Florida.",,,Italy,,
25399,,"July 24, 2025",,"Creekwood Naturals Recalls 100% Natural Pure Gum Spirits of Turpentine Bottles Due to Risk of Serious Injury or Death from Child Poisoning; Violates Mandatory Standard for Child Resistant Packaging","100% Natural Pure Gum Spirits of Turpentine Bottles","This recall involves Creekwood Naturals Gum Spirits of Turpentine bottles. The Gum Spirits of Turpentine comes in a clear glass bottle that has a brown label with red, black and white lettering. The front panel of the label on the bottle features ""Turpentine"" in large lettering, along with ""Pure Gum Spirits"" or ""Quality Gum Spirits.""","The recalled bottles contain turpentine, which must be in child-resistant packaging, as required by the Poison Prevention Packaging Act. The turpentine bottles violate the mandatory standard for child-resistant packaging, posing a deadly poisoning hazard to young children.",,,Replace,"About 9,000","None reported","Consumers should immediately secure the recalled turpentine bottles out of the sight and reach of children. Consumers should contact Creekwood Naturals for a free replacement child-resistant closure. Consumers must complete a form online at&nbsp;https://creekwoodnaturals.com/pages/recall to receive the replacement.","Sold Online At","Amazon, Etsy, Ebay and Creekwood Naturals from June 2023 through May 2025 for between $20 and $40.",,"Creekwood Naturals, of Corona, California",,"United States",,
25397,,"July 24, 2025",,"Diamond G Forest Products Recalls Turpentine Bottles Due to Risk of Serious Injury or Death from Child Poisoning; Violates Mandatory Standard for Child Resistant Packaging","Georgia Pine Gum Spirits of Turpentine Bottles","This recall involves 100% pure gum spirits of turpentine bottles. The 4-ounce, clear glass bottles are round and have a label with “Georgia Pine Gum Spirits of Turpentine” and “Diamond G Forest Products” printed on it.","The bottles contain turpentine, which must be in child-resistant packaging as required by the Poison Prevention Packaging Act. The packaging is not child-resistant, posing a risk of serious injury or death from poisoning if the contents are ingested by young children.",,,Replace,"About 20,000","None reported","Consumers should immediately secure the recalled turpentine bottles out of the sight and reach of children and contact Diamond G Forest Products for information on how to obtain a free replacement child-resistant closure.&nbsp;","Sold At","Nature’s Corner Market stores in Marietta, Georgia; Cornerstone Retreat stores in Gap, Pennsylvania; Nickel Mine Health Foods stores in Paradise, Pennsylvania; Leaves of The Trees in Memphis, Tennessee; Country Boy’s Mini Mall in Bristol, Georgia and online at Amazon from January 2021 through April 2025 for about $17.",,"Diamond G Forest Products LLC, of Patterson, Georgia",,"United States",,
25081,,"January 02, 2025",,"Euqee Wintergreen Essential Oils Recalled Due to Risk of Poisoning; Violation of the Poison Prevention Packaging Act; Sold Exclusively on Amazon.com by DLWL-US","Euqee Wintergreen Essential Oils","This recall involves Euqee Wintergreen Essential Oil Bottles. The oil was sold in amber glass bottles with a black screw-on cap in the size of 118 ml. “Euqee, Essential Oil, Premium Grade, 100% Pure Plant Extract and Wintergreen” is printed on a white label on the front of the bottle. The back label contains safety disclosures, storage instructions and manufacturer information.","The essential oil contains methyl salicylate, which must be in child-resistant packaging, as required by the Poison Prevention Packaging Act (PPPA). The packaging for the products is not child-resistant, posing a risk of poisoning if the contents are swallowed by young children. &nbsp;",,,Refund,"About 3,750","None reported","Consumers should immediately secure the recalled essential oil out of the sight and reach of children and contact DLWL-US for a full refund. Consumers can request a pre-paid label and free packaging to return the Euqee Wintergreen Essential Oil. DLWL-US and Amazon.com are contacting all known purchasers directly.","Sold At","Amazon.com from December 2023 through August 2024 for about $8.",,,,China,Retailer:,"DingLinWangLuoKeJiGuang ZhouYouXianGongSi, dba DLWL-US, of China"
