"Recall Number","Product Safety Warning Number",Date,"Product Safety Warning Date","Recall Heading","Name of product",Description,"Hazard Description","Consumer Action","Original Product Safety Warning Announcement","Remedy Type",Units,Incidents,Remedy,"Sold At Label","Sold At",Importers,Manufacturers,Distributors,"Manufactured In","Custom Label","Custom Field"
26252,,"February 05, 2026",,"Scepter Fuel Containers Recalled Due to Risk of Serious Injury or Death from Flash Fire, Burn and Child Poisoning; Violates Mandatory Standards for Portable Fuel Containers; Imported by Mameix Retail","Scepter Gas and Oil Combination Fuel Containers","This recall involves Scepter B62 gas and oil fuel containers. The recalled combination fuel containers are red with black caps and yellow spouts on each end. They have dual chambers with a 6-liter gas capacity on one side and 2.5-liter oil capacity on the other. “Scepter” and “Essence Danger” are embossed on the side of the container.","The recalled fuel containers violate the mandatory safety standards for portable fuel containers because they lack flame mitigation devices required under the https://www.cpsc.gov/Business--Manufacturing/Business-Education/Busines… lang=""EN"">Portable Fuel Container Safety Act, posing a deadly risk of flash fire. In addition, the Children’s Gasoline Burn Prevention Act requires all closures on portable gasoline fuel containers to be child resistant. The spout on the product is not child-resistant, posing a risk of burn and poisoning to children.&nbsp;",,,Refund,"About 700  ","None reported","Consumers should immediately stop using the recalled fuel containers, place them out of reach of children and contact Mameix Retail for a full refund. Consumers will be asked to write “Recalled” with permanent marker on the container and submit a photo of it in the trash to scepterrecall@gmail.com.&nbsp;","Sold Online At","Amazon.com from August 2024 through May 2025 for about $40.&nbsp;&nbsp;","Mameix Retail, Inc. of Canada",,,Canada,,
26234,,"January 29, 2026",,"Bazic Products Recalls Bazic Silicone Glue Due to Risk of Serious Injury or Death from Child Poisoning; Violates Mandatory Standard for Child Resistant Packaging and FHSA Labeling Requirements","Bazic Silicone Glue","This recall involves Bazic Silicone Glue, Model 2030.&nbsp; The glue comes in a transparent plastic bottle with a blue nozzle top and a blue and black wraparound label bearing instructions and warning statements. The glue’s label reads “Bazic”, “Silicone Glue”, and “Clear Adhesive Sealant” on the front, with cautionary statements and “2030” above the barcode on its side. Only Bazic Silicone Glue with batch code “V01233-031725-70004523"" printed on the side of the bottles are included in the recall.","The glue contains methanol, which must be in child-resistant packaging, as required by the&nbsp;https://www.cpsc.gov/Business--Manufacturing/Business-Education/Busines… Prevention Packaging Act. The glue’s packaging is not child-resistant, posing a risk of serious injury or death from poisoning if the contents are swallowed by young children. In addition, the glue violates the labeling requirements under the&nbsp;https://www.cpsc.gov/Business--Manufacturing/Business-Education/Busines… Hazardous Substances Act because it is incorrectly labeled as “Non-Toxic” and because it lacks a “highly flammable” hazard statement.",,,Refund,"About 21,170","None reported","Consumers should stop using the recalled Bazic Silicone Glue immediately and contact Bazic Products for instructions on how to submit a photo of the product to receive a full refund.Note: The recalled glue should be disposed of in accordance with any local and state regulations, contact your local hazardous waste treatment center. Do not dispose of methanol in sewers, rainwater pipes or ordinary garbage cans to avoid causing fires or environmental pollution.","Sold At","Shims Bargain Inc., Henry Lamond Co. Ltd., Universal Wholesale and D’notions &amp; crafts stores nationwide and online at Amazon.com and Walmart.com from May 2025 through October 2025 for about $3.","Bangkit USA Inc, dba Bazic Products, of El Monte, California",,,China,,
26210,,"January 22, 2026",,"Iristar Minoxidil Spray Bottles for Hair and Beard Growth Recalled Due to Risk of Serious Injury or Death from Child Poisoning; Violates Mandatory Standard for Child-Resistant Packaging; Sold on Amazon by Moralowen","Iristar Minoxidil Spray Bottles","This recall involves Iristar Minoxidil Spray Bottles, 5% minoxidil with biotin for hair and beard growth. The sprays come in black plastic bottles with navy blue labels and white highlights with a spray cap. The bottles and outer packaging are labeled “Iristar” and “Minoxidil Spray” on the front and ingredients and directions for use are found on the back.","The recalled spray bottles contain minoxidil, which must be in child-resistant packaging, as required by the&nbsp;https://www.cpsc.gov/Business--Manufacturing/Business-Education/Busines… Prevention Packaging Act. The packaging is not child-resistant, posing a risk of serious injury or death from poisoning if the contents are swallowed by young children.",,,Replace,"About 29,000","None reported","Consumers should immediately secure the recalled spray bottles out of sight and reach of children and contact Moralowen for a free replacement bottle with a child-resistant closure. Consumers are instructed to transfer the contents of the recalled bottle into the new child-resistant bottle. Once the product is transferred, consumers can continue to use the product as directed.","Sold Online At","Amazon.com from December 2024 through September 2025 for about $18.",,"Shaoshan Leiluo Trading Co., Ltd. of Shaoshan, Hunan of China",,China,Retailer:,"Moralowen, of South Korea"
26157,,"December 18, 2025",,"Plantimex Recalls Mamisan Lidocaine Ointment Containers Due to Risk of Serious Injury or Death from Child Poisoning; Violates Mandatory Standard for Child-Resistant Packaging","Mamisan Pain Relieving Topical Ointment","This recall involves Mamisan Pain Relieving Topical Ointment jars. The ointment comes in an orange container with a white continuous thread lid and has the Mamisan trademark printed on top of the lid and on the label. The ointment was sold in a 3.52 ounce plastic jar. The wraparound label includes instructions and drug facts. Only jars with UPC code 860006498115 are included in the recall.","The ointment contains lidocaine, which must be in child-resistant packaging, as required by the&nbsp;https://www.cpsc.gov/Business--Manufacturing/Business-Education/Busines… lang=""EN"">Poison Prevention Packaging Act. The ointment’s packaging is not child-resistant, posing a risk of serious injury or death from poisoning if the contents are swallowed by young children.",,,Repair,"About 50,330","None reported","Consumers should immediately secure the recalled ointment jars out of the sight and reach of children and contact Plantimex to receive a free replacement lid. Once the product is secured with the replacement lid, consumers can use the product, as directed.","Sold At","Walmart and Target stores nationwide and online at Target.com from April 2024 through October 2025 for about $10.",,"MiramarLab, of Doral, Florida","Plantimex Distributors, Inc., of San Diego, California","United States",,
25354,,"June 26, 2025",,"iHerb Recalls Bottles and Blister Packs of California Gold Nutrition Iron Supplements Due to Risk of Serious Injury or Death from Child Poisoning; Violation of Federal Standard for Child Resistant Packaging","California Gold Nutrition Iron Supplements: Daily Prenatal Multi, Ultamins Women’s Multivitamin, and Ultamins Women’s 50+ Multivitamin","This recall involves three types of California Gold Nutrition dietary supplements: Daily Prenatal Multi, Ultamins Women’s Multivitamin, and Ultamins Women’s 50+ Multivitamin.&nbsp;The California Gold Nutrition Daily Prenatal Multivitamin bottles are white with a white lid and a gold border label. The bottle contains 60 fish gelatin softgel dietary supplements.&nbsp; &nbsp; &nbsp;The California Gold Nutrition Women’s Multivitamin and Women’s 50+ Multivitamin both have dark purple packaging with a gold border label. Both products contain 60 capsules in foil within the packaging. The following batch numbers and expiration dates for the products are printed on the back of the package near the bottom of package/sleeve.&nbsp;ProductsBatch CodesExpiration DatesDaily Prenatal Multi2307050A, 2404096A, 2411100A08/2025, 05/2026, 11/2026Ultamins Women’s MultivitaminV0532, V053311/2026, 07/2026Ultamins Women’s 50+ MultivitaminV0534, V053607/2026, 11/2026","The recalled dietary supplements contain iron, which must be in child-resistant packaging, as required by the&nbsp;https://www.cpsc.gov/Poison-Prevention-Packaging-Act"">Poison Prevention Packaging Act. The iron-containing dietary supplement packages violate the federal standard for child-resistant packaging because the bottles and blister packs are not child-resistant, posing a risk of deadly poisoning, if the contents are swallowed by young children.",,,Refund,"About 60,000","None reported","Consumers should immediately secure the recalled supplement bottles out of sight and reach of children and contact iHerb for a refund and information on how to safely discard the packaging and product. To receive a refund, consumers should email ProductRecall@iherb.com with the subject line: “Iron Supplement Refund” and provide the following information:&nbsp;NameProduct(s) name &amp; quantity orderedEvidence of destruction: initial and date each product package and include a photo with your initials and the date visibleOptional: Provide the order number associated with the purchase(s), which can be found by logging into consumer’s account and viewing the “Order History”.&nbsp;iHerb is contacting all known purchasers directly.","Sold At","Online at Amazon.com, Walmart.com, Target.com and other websites from January 2019 through April 2025 for between $8 and $18.",,"iHerb LLC, dba Madre Labs LLC, of Irvine, California",,"United States",,
25201,,"March 27, 2025",,"NFH Iron Dietary Supplement Bottles Recalled Due to Risk of Poisoning; Violation of Federal Regulation for Child Resistant Packaging; Imported by Nutritional Fundamentals for Health (NFH)","NFH Iron SAP, NFH Heme Iron SAP and NFH Prenatal SAP bottles","This recall involves NFH Dietary Supplement bottles for Iron SAP, Heme Iron SAP and Prenatal SAP. The bottles are white with the brand name “NFH” and the firm’s logo of a leaf in blue. The date code is on the bottom of the bottle. The recalled dietary supplement bottles have the following description and come in various sizes:Product NameDescriptionSizesDate CodesIron SAPIron Glycinate60 Capsules (1029U)120 Capsules(1167U)60 capsules&nbsp;5398705/31/20275398805/31/20275398512/31/20265398612/31/20265398306/30/20265398406/30/2026N00274 07/31/2025120 capsules&nbsp;538975/31/2027539875/31/2027539885/31/20275398512/31/20265398612/31/2026539846/30/2026N00274 6/30/2025Heme Iron SAP (Porcine)&nbsp;Superior Absorption and Bioavailability60 Capsules(1124U)N00265 - 03/31/202553809 - 05/31/202653810 - 07/31/2026&nbsp; &nbsp; &nbsp;57807 - 10/30/202653811 - 10/31/202657806 - 10/31/202662379 - 08/31/2027Prenatal SAPMultivitamin&nbsp;180 Capsules(1034U)5821709/30/20275822009/30/20275736105/31/20275736905/31/20275737005/31/20275737205/31/20275821405/31/20275396803/31/20275719401/31/20275736001/31/20275396311/30/20265396411/30/20265396511/30/20265396611/30/20265396711/30/20265395410/31/20265395610/31/20265395810/31/20265396010/31/20265396110/31/20265396210/31/20265395307/31/20265394605/31/20265394504/30/2026N00287 08/31/2025N00285 04/30/2025N00284 03/31/2025","The recalled dietary supplements contain iron, which must be in child-resistant packaging, as required by the Poison Prevention Packaging Act (PPPA). The packaging is not child-resistant, posing a risk of poisoning if the contents are swallowed by young children.",,,Replace,"About 17,660","None reported","Consumers should immediately secure the recalled supplement bottles out of sight and reach of children, and contact NFH for information on how to obtain a free replacement child-resistant bottle. NFH is contacting all known purchasers directly. This recall only includes the bottle.","Sold At","Multiple naturopathic/homeopathic clinics nationwide, A Woman's Time and Doctor Supplement stores, and online at WholescriptsInc.com and Natural Partners (Fullscript.com) from March 2022 through December 2024 for between $20 and $95, depending on the product and the size.","Nutritional Fundamentals for Health (dba NFH), of Canada","Nutritional Fundamentals for Health (dba NFH), of Canada",,Canada,,
25173,,"March 06, 2025",,"Taylor Water Technologies Recalls Phosphate Reagent Bottles Sold with Test Kits Due to Risk of Severe Chemical Burns; Violation of Federal Regulation for Child-Resistant Packaging","Phosphate Reagent #1 Bottles sold within the Taylor Phosphate Test Kits","This recall involves the replacement reagent #1 bottles sold with Taylor Phosphate Test Kits #K-1106 and also sold separately. The kits are used to test the level of phosphate in water for pools, spas and aquariums. The water testing kits are labeled with the brand name “Taylor,” the kit name “Phosphate Test” and part number “K-1106.” The bottle in the kit that contains sulfuric acid is labeled with the brand name “Taylor,” product name “Phosphate Reagent #1,” part number “R-0980” and “A Size: 22 mL (.75 oz).” The replacement reagent bottle that is sold separately has the same label. Phosphate Reagent #1 has a shelf-life of 24 months.&nbsp;&nbsp;","The recalled Taylor Water Technologies reagent bottles sold with test kits contain sulfuric acid, which must be in child-resistant packaging, as required by the Poison Prevention Packaging Act (PPPA). The packaging for the bottle with sulfuric acid is not child resistant, posing a risk of chemical burns to the skin or eyes and internal corrosive burns, if ingested.",,,Replace,"About 10,000","None reported","Consumers should stop using the recalled Phosphate Reagent #1 bottles immediately, place them in a safe and secure location away from the reach of children and contact Taylor Water Technologies for information on how to properly dispose of the recalled bottle and obtain a free replacement bottle. Only unexpired Phosphate Reagent #1 bottles are included in this recall and eligible for the free replacement. Taylor Water Technologies is contacting all known purchasers directly.","Sold At","Online at www.taylortechnologies.com and other websites and in pool and aquarium stores nationwide from August 2022 through August 2024 for about $13 for the reagent bottles and $56 for the kits that include the reagent bottles.",,"Taylor Water Technologies LLC, of Sparks, Maryland",,"United States",,
25110,,"January 30, 2025",,"Cabinet Health Recalls 4 oz. Refillable Medicine Bottles Due to Failure to Retain Child-Resistance; Risk of Child Poisoning","Cabinet Health 4 oz. Refillable Medicine Bottles","This recall involves certain Cabinet Health 4 oz. Refillable Medicine Bottles with ABS plastic lids. The bottles are made of clear glass with blue, turquoise, orange or purple plastic lids labeled “CABINET.” Cabinet Health sold the bottles filled with over-the-counter drugs or as empty 4 oz. bottles.&nbsp;The recalled empty 4 oz. bottles were sold via cabinethealth.com from March 2023 through July 2024. Consumers with recalled empty bottles can identify them by the date of purchase. The recalled bottles filled with over-the-counter drugs have the following date codes on a sticker on the bottom of the bottle.Medication NameLid ColorDate CodesTension Headache - Refillable Glass Bottle (Acetaminophen 500mg Caffeine 65mg) - 100 CountBlue2029J072232029J076232029J07723Allergy Relief - Refillable Glass Bottle (Diphenhydramine HCl 25mg) - 120 CountTurquoise2265J07323Pain Reliever and Nighttime Sleep Aid - Refillable Glass Bottle (Acetaminophen 500mg, Diphenhydramine 25mg) - 120 CountBlue2127J068232127J233233040J233233051J233233051J23423Pain Reliever and Fever Reducer - Refillable Glass Bottle (Acetaminophen 500mg) - 120 CountBlue2286J063232286J065232286J066232287J066232287J06723Cough Relief - Refillable Glass Bottle (Dextromethorphan Hbr 15mg) - 60 CountOrange2010J069232010J070233004J296233010J296233025J29623Sleep Aid - Refillable Glass Bottle (Diphenhydramine HCl 50mg) - 70 CountPurple3021J068233021J069233034J234233034J23523","The plastic lid’s closure can degrade after repeated openings, causing the lid’s child-resistance to diminish, posing a risk of poisoning, if the contents are swallowed by young children.",,,Replace,"About 65,000 ","None reported.","Consumers should immediately secure the recalled bottles out of the sight and reach of children and contact Cabinet Health for a free replacement lid. Consumers will be asked to submit a photo demonstrating the destruction of the recalled lid. Cabinet Health and Amazon are contacting all known purchasers directly. This recall does not affect the medication within the bottles.","Sold At","Online at cabinethealth.com, Amazon.com and Grove.co and at CVS stores from March 2023 through July 2024 for between $10 and $20.",,"Cabinet Health Inc., of Washington, D.C.&nbsp;",,China,,
24189,,"April 05, 2024",,"Procter & Gamble Recalls 8.2 Million Defective Bags of Tide, Gain, Ace and Ariel Laundry Detergent Packets Distributed in US Due to Risk of Serious Injury","Tide Pods, Gain Flings, Ace Pods and Ariel Pods liquid laundry detergent packets packaged in flexible film bags. This recall announcement applies only to bags distributed in the United States.","This recall involves certain lot codes of Tide Pods, Gain Flings, Ace Pods, and Ariel Pods liquid laundry detergent packets packaged in flexible film bags that were manufactured between September 2023 and February 2024. Recalled products range from bags with 12 to 39 laundry detergent packets and include the following:&nbsp;Gain Flings Original&nbsp;Tide Simply Pods Plus Oxi Boost&nbsp;Gain Flings Moonlight Breeze Scent&nbsp;Tide Pods Clean Breeze Scent&nbsp;Gain Flings Blissful Breeze Scent&nbsp;Tide Pods Free &amp; Gentle&nbsp;Gain Flings Spring Daydream Scent&nbsp;Tide Pods Oxi&nbsp;Gain Flings Plus Ultra Oxi&nbsp;Tide Pods Ultra Oxi&nbsp;Gain Flings Plus Odor Defense&nbsp;Ace Pods Clean Breeze&nbsp;Tide Pods Original&nbsp;Ace Pods Spring Meadow&nbsp;Tide Pods Spring Meadow Scent&nbsp;Ariel Pods Alpine Breeze&nbsp;Tide Pods Light&nbsp;&nbsp;","The outer packaging meant to prevent access to the contents can split open near the zipper track, posing a risk of serious injury to children and other vulnerable populations if the contents of the laundry detergent packets are ingested, as well as posing a risk of skin or eye injuries. Ingestion of a large quantity of any surfactant-containing household cleaning products can cause death among individuals with underlying health issues.",,,"Refund, Replace","About 8.2 million (In addition, about 56,741 were sold in Canada)","No confirmed cases directly relating to this packaging defect. The firm has received four reports of children in the United States accessing the liquid laundry packets, three of which reported ingestion during the time period that the recalled lots were sold, but it is not known if these laundry packets came from recalled bags.","Consumers should immediately secure the recalled bags out of sight and reach of children and contact Procter &amp; Gamble for a full refund and a free replacement child-resistant bag to store the product. Consumers can also receive a cabinet lock for securing laundry materials.&nbsp;Consumers should check to see if their bag is part of the recall by checking the lot code on their bag.&nbsp; Recalled lot codes will be listed at pg.com/bags and are found on the bottom of the package.&nbsp; Consumers with recalled bags can submit a photo of the recalled product, showing the lot code to participate in the recall.","Sold At","Big Lots, CVS, Family Dollar, Home Depot, Sam’s Club, Target, Walmart, and other major stores nationwide and online at Amazon.com and other websites from September 2023 through present for between $5 (one 12 ct. bag) and $30 (four 39 ct. bags in a box).",,"The Procter &amp; Gamble Company, of Cincinnati, Ohio",,"United States",,
